Song Name,Song ID,Genres
Flashing Lights,5TRPicyLGbAF2LGBFbHGvO,"chicago rap, hip hop, rap"
505,58ge6dfP91o9oXMzq3XkIS,"garage rock, modern rock, permanent wave, rock, sheffield indie"
I Wonder,7rbECVPkY5UODxoOUVKZnA,"chicago rap, hip hop, rap"
Misery Business,6SpLc7EXZIPpy0sVko0aoU,"candy pop, modern rock, pixie, pop, pop emo, pop punk, rock"
Homecoming,4iz9lGMjU1lXS51oPmUmTe,"chicago rap, hip hop, rap"
Stronger,0j2T0R9dR9qdJYsB7ciXhf,"chicago rap, hip hop, rap"
Can't Tell Me Nothing,0mEdbdeRFQwBhN4xfyIeUM,"chicago rap, hip hop, rap"
The Way I Are,2bLqfJjuC5syrsgDsZfGmn,"dance pop, pop, pop rap"
Thnks fr th Mmrs,3Zwu2K0Qa5sT6teCCHPShP,"emo, modern rock, pop, pop punk, rock"
Paralyzer,28IEbk5a7twNTbUEvWslUb,"alternative metal, canadian rock, funk metal, nu metal, post-grunge"
Buy U a Drank (Shawty Snappin') (feat. Yung Joc),1tkMs9wDPknQ3ZHcKDw1ES,"dance pop, gangster rap, hip hop, pop rap, r&b, rap, southern hip hop, trap, urban contemporary"
Fake It,4eAwB5pnKFTmsgc3zWoYO0,"alternative metal, nu metal, post-grunge, south african rock"
Umbrella,2yPoXCs7BSIUrucMdK5PzV,"barbadian pop, pop, urban contemporary"
Electric Feel,3FtYbEfBqAlGO46NUDQSAt,"alternative rock, indie rock, indietronica, modern rock, rock"
"Dear Maria, Count Me In",0JJP0IS4w0fJx01EcrfkDe,"modern rock, neon pop punk, pop punk"
Good Life,4ZPdLEztrlZqbJkgHNw54L,"chicago rap, hip hop, rap"
Paper Planes,1ixbwbeBi5ufN4noUKmW5a,"escape room, indietronica, neo-synthpop, new rave"
Beautiful Girls,1hGy2eLcmC8eKx7qr1tOqx,"dance pop, miami hip hop, pop"
Fluorescent Adolescent,7e8utCy2JlSB8dRHKi49xM,"garage rock, modern rock, permanent wave, rock, sheffield indie"
Bleed It Out,0UFDKFqW2oGspYeYqo9wjA,"alternative metal, nu metal, post-grunge, rap metal, rock"
What I've Done,18lR4BzEs7e3qzc0KVkTpU,"alternative metal, nu metal, post-grunge, rap metal, rock"
You,5W4kiM2cUYBJXKRudNyxjW,contemporary country
Crank That (Soulja Boy),66TRwr5uJwPt15mfFkzhbi,"atl hip hop, chicago bop, dance pop, pop rap, rap, southern hip hop, trap"
The Pretender,7x8dCjCr0x6x2lXKujYD34,"alternative metal, alternative rock, modern rock, permanent wave, post-grunge, rock"
Gimme More,6ic8OlLUNEATToEFU3xmaH,"dance pop, pop"
Bartender (feat. Akon),1RGIjMFMgJxkZHMDXVYzOJ,"dance pop, gangster rap, hip hop, pop rap, r&b, rap, southern hip hop, trap, urban contemporary"
Kids,1jJci4qxiYcOHhQR247rEU,"alternative rock, indie rock, indietronica, modern rock, rock"
Don't Stop The Music,1Jo0Zg7XlrA6z0mFTZVdkn,"barbadian pop, pop, urban contemporary"
Everything I Am,0NrtwAmRAdLxua31SzHvXr,"chicago rap, hip hop, rap"
All Summer Long,5rX6C5QVvvZB7XckETNych,nu metal
Apologize,1NrJYpdAi7uosDRPmSYrsG,"piano rock, pop"
Champion,4UQMOPSUVJVicIQzjAcRRZ,"chicago rap, hip hop, rap"
Valerie (feat. Amy Winehouse) - Version Revisited,6kopmMZiyLmw7h66uXcXR7,pop soul
That's What You Get,1JdKrFyoU05abww0Zv0ayQ,"candy pop, modern rock, pixie, pop, pop emo, pop punk, rock"
Good Morning,6MXXY2eiWkpDCezVCc0cMH,"chicago rap, hip hop, rap"
Verbatim,266Vb7ItE3o1q8HdJ9QOvn,"pov: indie, vancouver indie"
Bleeding Love,7wZUrN8oemZfsEd1CGkbXE,"british soul, dance pop, pop, talent show"
Pocketful of Sunshine,1uigwk5hNV84zRd5YQQRTk,"dance pop, pop, post-teen pop"
Bubbly,0rFOs9paloAvEtzwDX1Kmc,"dance pop, neo mellow, pop"
Love Song,6qL5UWxRSQYml9O99ozoLv,contemporary r&b
Girlfriend,45hOioMDJktr86iKDHC8gr,"canadian pop, candy pop, pop"
Jigsaw Falling Into Place,0YJ9FWWHn9EfnN0lHwbzvV,"alternative rock, art rock, melancholia, oxford indie, permanent wave, rock"
Because Of You,6CFPFnS9EcLs2I0nWqtWci,"dance pop, pop, r&b, urban contemporary"
"Check Yes, Juliet",0wVluBsVAVzBKrqspuCcwR,"neon pop punk, piano rock, pop punk"
Weird Fishes/ Arpeggi,4wajJ1o7jWIg62YqpkHC7S,"alternative rock, art rock, melancholia, oxford indie, permanent wave, rock"
Let It Go,13HVjjWUZFaWilh2QUJKsP,"neo mellow, pop, uk pop"
Time to Pretend,4iG2gAwKXsOcijVaVXzRPW,"alternative rock, indie rock, indietronica, modern rock, rock"
Given Up,1fLlRApgzxWweF1JTf8yM5,"alternative metal, nu metal, post-grunge, rap metal, rock"
Come On Get Higher,38YgZVHPWOWsKrsCXz6JyP,"acoustic pop, neo mellow"
Gunpowder & Lead,3z1PqYwMtct2Dm4R9lhWnT,"contemporary country, country, country dawn, country road"
crushcrushcrush,3VA4sjTMSTTF02hFGmlpJh,"candy pop, modern rock, pixie, pop, pop emo, pop punk, rock"
Beautiful Liar,2HWWNoWEEEECwZhAiLg7ib,"pop, r&b"
Kiss Kiss (feat. T-Pain),3wKKkGVn7cVSfgPeYYIiXG,"pop rap, r&b, rap"
Give It To Me,0wbDgMuAoy7O7pL3a69uZx,"dance pop, pop, pop rap"
Ella Me Levanto,7fGODUqa0gtkb72oBVCgCD,"latin hip hop, reggaeton, trap latino, urbano latino"
Int'l Players Anthem (I Choose You),4ns1XFP3W5JPyzvnAjMdHD,dirty south rap
To Build A Home,3AqPL1n1wKc5DVFFnYuJhp,"downtempo, nu jazz"
"This Ain't A Scene, It's An Arms Race",1oagRT7LfpVlNJN6FSZDGp,"emo, modern rock, pop, pop punk, rock"
Oh Ana,45i70K1PefHafKui2WxH0M,"pov: indie, vancouver indie"
See You Again,7KA4W4McWYRpgf0fWsJZWB,"hip hop, rap"
X Gon' Give It To Ya,1zzxoZVylsna2BQB65Ppcb,"east coast hip hop, gangster rap, hardcore hip hop, hip hop, rap"
Afterlife,7zAt4tdL44D3VuzsvM0N8n,"alternative metal, nu metal"
Hypnotize - 2007 Remaster,6Tsu3OsuMz4KEGKbOYd6A0,"east coast hip hop, gangster rap, hardcore hip hop, hip hop, rap"
With You,34SQ0QfLSR316d8KL2zkuZ,"classic texas country, contemporary country"
No Air (feat. Chris Brown),1jUA4rb6ZCv4gby4YU53xq,"dance pop, pop, post-teen pop"
Can't Help but Wait,5k3VjTwIsOjQ2woGz3Yx71,"dance pop, r&b, southern hip hop, trap, urban contemporary"
Psycho,3swc6WTsr7rl9DqQKQA55C,"dfw rap, melodic rap, pop, rap"
Lip Gloss,1Y4ZdPOOgCUhBcKZOrUFiS,"hip pop, trap queen"
Hoja En Blanco,0wDEs6WvqDHq4XJZC0dHhO,"bachata, bachata dominicana, tropical"
Shut Up And Drive,4QdX6pmNnJ5cleufWQIr5D,"barbadian pop, pop, urban contemporary"
All I Need,02FAxAwzApe6pAqfAL3dLr,"contemporary country, country, country road, modern country rock"
Bang Bang Bang Bang,2qLSXZuIHMsKydCEFDchc3,electronic rock
Un Millón de Primaveras,6j5LtifAnuTjTYvml61yFZ,"mariachi, ranchera"
No One,6NvRxjfYkkT2SpirAlmsjH,"alternative metal, alternative rock, grunge, modern rock, nu metal, palm desert scene, rock, stoner metal, stoner rock"
No One,6NvRxjfYkkT2SpirAlmsjH,"alternative metal, alternative rock, grunge, modern rock, nu metal, palm desert scene, rock, stoner metal, stoner rock"
Big Poppa - 2007 Remaster,63BcfK6YAzJYeISaTPr6IO,"east coast hip hop, gangster rap, hardcore hip hop, hip hop, rap"
Real Muthaphuckkin' G's,53BZ6XygAoubR5DU5w38Vq,"g funk, gangster rap, hip hop, rap, west coast rap"
I Don't Wanna Stop,5axOkQnmQmwtjr4bv1Xt7i,"album rock, alternative metal, birmingham metal, classic rock, glam metal, hard rock, metal, nu metal, rock"
All-American Girl,2dRPQFwPqAmc42mDRnsDQu,"classic oklahoma country, contemporary country, country, country dawn, country road, dance pop, pop"
Teddy Picker,4OkPamOn5GofkOQu64Z4eR,"garage rock, modern rock, permanent wave, rock, sheffield indie"
Shake It,5xTtaWoae3wi06K5WfVUUH,pop
Superstar (feat. Matthew Santos),7dltD9eEX7X1zk8JJ9BS0e,"chicago rap, conscious hip hop, hip hop, political hip hop, pop rap, rap, southern hip hop"
Hang Me Up To Dry,3IXRdLsQib8m0hBbQpe7T8,"indie rock, modern alternative rock, modern rock, piano rock, stomp and holler"
Nude,35YyxFpE0ZTOoqFx5bADW8,"alternative rock, art rock, melancholia, oxford indie, permanent wave, rock"
"Wipe Me Down (feat. Foxx, Webbie & Lil Boosie) - Remix",6D1CstH1YvzNN8cPd9ay9Q,"baton rouge rap, dirty south rap, memphis hip hop, southern hip hop, trap"
Irreplaceable,6RX5iL93VZ5fKmyvNXvF1r,"pop, r&b"
Cyclone (feat. T-Pain) - Main,0x1LCpY9Rgeq97VPajm81B,"chicano rap, latin hip hop, pop rap, southern hip hop, texas latin rap, urban contemporary"
Get It Shawty,2a03afRiyAbNAleOByVju4,"hip pop, r&b, southern hip hop, trap, urban contemporary"
Jamie All Over,05qCCJQJiOwvPQBb7akf1R,"neon pop punk, pop emo, pop punk"
"Flightless Bird, American Mouth",1fEGtTZjrjJW8eUeewnNJR,"acoustic pop, chamber pop, indie folk, indie rock, stomp and holler"
Chelsea Dagger,3ItzRpwvKtkDSNdRSjXu7Z,"garage rock, modern rock, scottish rock"
Potential Breakup Song,11dxtPJKR4E0wlSr0A0t47,"dance pop, girl group, post-teen pop"
Hypnotized (feat. Akon),3LN41NUdHkyNqQhi9gExMm,"dirty south rap, miami hip hop, southern hip hop, trap"
Southside Of Heaven,0qCQg5TkfBfkTsQP3IhAmC,"classic texas country, new americana, outlaw country"
How Far We've Come,0gbLfFlEyVHiKzlZIb0gce,"neo mellow, pop rock, post-grunge"
Australia,47TQjzeG4KI0XWWb0wkbri,"albuquerque indie, alternative rock, canadian indie, chamber pop, indie pop, indie rock, modern rock, portland indie, seattle indie, shimmer pop, stomp and holler"
Dos Locos,3mx8WfEOjeUB1a0fpFxQmi,"bachata, bachata dominicana, tropical"
You're Gonna Miss This,7Efs0OIW6zgQyH7ehKZYpN,"contemporary country, country, country road"
California Love - Original Version,3ia3dJETSOllPsv3LJkE35,"g funk, gangster rap, hip hop, rap, west coast rap"
I Luv Your Girl,3wkNK8tJZ2stygNJm8RCRD,"dirty south rap, hip pop, r&b, southern hip hop, trap, urban contemporary"
Icky Thump,2LMq1O0NiqGhPOlXo3McYQ,"alternative rock, blues rock, detroit rock, garage rock, modern blues rock, permanent wave, punk blues, rock"
Won't Go Home Without You,0tuyEYTaqLxE41yGHSsXjy,pop
Party Like A Rock Star,1IYaMVfidzSfvCUZYXhsU1,"atl hip hop, dirty south rap, futuristic swag"
I'll Take You There,5YLnfy7R2kueN0BRPkjiEG,"chicago soul, classic soul, memphis soul, soul, southern soul"
S.O.S.,6sDP4912wjwB7BJhbSnjS1,"boy band, pop"
How Do I Breathe,174rZBKJAqD10VBnOjlQQ3,"dance pop, hip pop, r&b, southern hip hop, urban contemporary"
Brianstorm,5rTIpPWeO0IL4HWlGWrz5G,"garage rock, modern rock, permanent wave, rock, sheffield indie"
Te Quiero,0yrvmIafnxkkMCMAIaDgiQ,"panamanian pop, reggaeton"
Bed,3iL2l5gUqyPS6vDwJFgJTR,"dirty south rap, pop rap, rap, southern hip hop, trap"
The Stable Song,3G9ETaH55bMQx8hwNhAgbU,"indie folk, pop folk, stomp and flutter, stomp and holler"
Estos Celos,6u6kH7V7Tx5xDJtF82vVw0,"mariachi, ranchera"
Cupid Shuffle,07Tx168RSsUS1HqkDIOZbH,kids dance party
Shawty (feat. T Pain),0mYoKqA23wUUj7BTEgNzjg,"dirty south rap, miami hip hop, southern hip hop, trap"
Dashboard,0Fe3WxeO6lZZxj7ytvbDUh,"alternative rock, chamber pop, indie rock, indietronica, modern rock, washington indie"
Watching Airplanes,63u5QGp9dKXAoYTVKUKBYn,"contemporary country, country, country road"
Apologize,1NrJYpdAi7uosDRPmSYrsG,"piano rock, pop"
"Sonata No. 14 ""Moonlight"" in C-Sharp Minor"", Op. 27 No. 2: I. Adagio sostenuto",3DNRdudZ2SstnDCVKFdXxG,"classical, classical era, early romantic era, german romanticism"
X Gon' Give It To Ya,1zzxoZVylsna2BQB65Ppcb,"east coast hip hop, gangster rap, hardcore hip hop, hip hop, rap"
Edge of Seventeen,7L3b6iaVhDVjfo52Hbvh9Z,heartland rock
Careless Whisper,4jDmJ51x1o9NZB5Nxxc7gY,new wave pop
Leave Out All The Rest,0sp00HSXkQyqTa6QqM0O8V,"alternative metal, nu metal, post-grunge, rap metal, rock"
Sexy Movimiento,1Kgyx7NLtzsa3gWV1efGHu,"electro latino, reggaeton, trap latino, urbano latino"
1234,2CzWeyC9zlDpIOZPUUKrBW,"art pop, canadian indie, canadian pop, chamber pop, indie pop, indie rock"
A Little Piece of Heaven,1BLfQ6dPXmuDrFmbdfW7Jl,"alternative metal, nu metal"
I Don't Wanna Be In Love (Dance Floor Anthem),36UVZPoK8a1Oxh13cY8kOp,"alternative metal, modern rock, neon pop punk, pop punk, pop rock, post-grunge"
"Welcome Home, Son",6HTVZeVQ9J6Uiq6tHESxU9,"indie folk, jacksonville indie, stomp and holler"
Ahora Es,15wPtgg6jsyMLhIkjcSpl4,"electro latino, reggaeton, trap latino, urbano latino"
Hood Nigga,323Tzd2yjV4pifrVAajafb,"atl hip hop, crunk, dirty south rap, futuristic swag, southern hip hop, trap"
Do Me a Favour,13NCxLOlvQ4Tnexgfp03Gs,"garage rock, modern rock, permanent wave, rock, sheffield indie"
Feeling Alright,2EDRUNdur7CGV2W2mwIRoS,reggae rock
Almost Easy,0DkmhHO4yyqCJFjosmmWPU,"alternative metal, nu metal"
Everything,3ZCTVFBt2Brf31RLEnCkWJ,"art pop, electropop, pop"
Iris,6Qyc6fS4DsZjB2mRW9DsQs,"neo mellow, permanent wave, pop rock, post-grunge"
The Glory,0lWjRSzq5chA9fps3pM8Zr,"chicago rap, hip hop, rap"
2am,3vZGtceCbJVh5aDT4XhE0p,"pop, r&b, rap"
The Story,6dTA6y0C2ReQklntzZl8l3,pop
Grace Kelly,7dzUZec5MnWMyQnk5klnKR,pop rock
Take You Down,1vwUsp52io0AGQ5yv470IC,"pop rap, r&b, rap"
Apologize,1NrJYpdAi7uosDRPmSYrsG,"piano rock, pop"
Stop And Stare,48s0QHJgmiNsth3WEO6U4M,"piano rock, pop"
"That's How You Know - From ""Enchanted""/Soundtrack Version",7KBv99i97JPJAnCPFuaxhr,movie tunes
All My Friends Say,539dFCMA8lfEElDPgGpcIB,"contemporary country, country, country road, modern country rock"
Tell Me,2lp8xjq0WTm3HZKHuDEweg,"contemporary r&b, new jack swing"
Only Ones Who Know,7ABWRukVQcXrIrDKDx5Gek,"garage rock, modern rock, permanent wave, rock, sheffield indie"
Prometiste Volver,0su1fVTl8eVEd7TjY7vQBG,"banda, duranguense, grupera, musica mexicana, norteno"
Gravity,3zakx7RAwdkUQlOoQ7SJRt,"r&b, rap"
Pretty Handsome Awkward,77BfOPXhlnNaSbg647qkx2,"alternative metal, neon pop punk, pop emo, post-grunge, post-hardcore, screamo"
Shawty Is Da Shit,5RC9YDHON0nXKmcQrL6WV6,"dirty south rap, hip pop, r&b, southern hip hop, trap, urban contemporary"
Eyes on Fire,3XHrTm6WE2BOHafLwTT3GR,dream pop
Sunrise,0JtgoDDf0ggWaoXCGhcOoT,contemporary country
Porque Me Tratas Así?,6NoFVCCFpjWsHVYvinUeZG,"electro latino, reggaeton, trap latino, urbano latino"
Tambourine,1U16aNzvnlfARgjWXjKmQj,"contemporary r&b, dance pop, hip pop, philly rap, r&b, urban contemporary"
One More Chance / Stay with Me - Remix; 2007 Remaster,7fXhkARAtS66kxexMIAx8O,"east coast hip hop, gangster rap, hardcore hip hop, hip hop, rap"
No Te Veo - Digital Single,40EDOraCqoiMf14TzODihf,reggaeton
Unwell - 2007 Remaster,0PXWpNBYg52gABrn1qL1bD,"neo mellow, pop rock, post-grunge"
West Coast,5Y6nVaayzitvsD5F7nr3DV,"art pop, pop"
Old Yellow Bricks,3BcQFPRZuuUClWStz29WjN,"garage rock, modern rock, permanent wave, rock, sheffield indie"
Big Brother,2L47m9erkB5KBZcaqWtYen,"chicago rap, hip hop, rap"
What A Feeling,0aAR5HogGoT68EWFbyRFqx,"disco, new romantic, new wave pop, soft rock"
Amor Mortal (Version Nortena),7nAqJOLfakLfvssR7p8cUN,"banda, corrido, musica mexicana, norteno, sierreno"
Since U Been Gone,3xrn9i8zhNZsTtcoWgQEAd,"dance pop, pop, talent show"
Hate That I Love You,669Zz4glMcFwFl1BRltkXP,"barbadian pop, pop, urban contemporary"
The Other Side,2cKovq3l6OJjhVVDbVKOsr,"hollywood, show tunes"
The Great Escape,56Tl3UgyZTqfZtvFNS31wm,"neon pop punk, pop punk"
Get Money (feat. Junior M.A.F.I.A.) - 2007 Remaster,3PA9dH8cT0wR5UW4XkC44Y,"east coast hip hop, gangster rap, hardcore hip hop, hip hop, rap"
On the Hotline - Amended Version,1zyqZONW985Cs4osz9wlsu,"dirty south rap, hip pop, miami hip hop, r&b, southern hip hop, trap, urban contemporary"
We Takin' Over,6YdzlsQcyXoWjAykR0rjj3,"hip hop, miami hip hop, pop rap, rap"
Last Night,59uQI0PADDKeE6UZDTJEe8,contemporary country
Breakdown,5x53pbGk6sbl1BGom19QQ5,"album rock, classic rock, hard rock, heartland rock, mellow gold, rock, singer-songwriter, soft rock"
Por Tu Amor - Duranguense,1jBYN6IEVkExTE3R4O9trC,"duranguense, musica mexicana"
Heaven Sent,0kuP3lMxCikBd7nPBIdjv8,emoplugg
House Of Cards,48X4D1FYOShPz2VF3YdfCF,"alternative rock, art rock, melancholia, oxford indie, permanent wave, rock"
Barry Bonds,7387VaiHpOsSIZ5nmjseya,"chicago rap, hip hop, rap"
Still Dreaming,72nLaDnt2dfxCA3ZAiEC2c,"conscious hip hop, east coast hip hop, gangster rap, hardcore hip hop, hip hop, queens hip hop, rap"
Shadow of the Day,0OYcEfskah1egYHjYRvbg1,"alternative metal, nu metal, post-grunge, rap metal, rock"
Deja Vu (feat. Jay-Z),423EcxblW9F4nnQkqcqMlK,"pop, r&b"
Dream A Little Dream Of Me - Single Version,78MI7mu1LV1k4IA2HzKmHe,"adult standards, jazz, jazz blues, soul, swing, vocal jazz"
When You Look Me In The Eyes,4kf33kU0KAlkNBK9pNbYNU,"boy band, pop"
Ladies And Gentlemen,48ncRBVLgiu8MY7O70VVw5,"alternative metal, nu metal, rap metal"
Under and Over It,0xKFHPdmWipLYPG3zlPpr4,"alternative metal, groove metal, nu metal"
Toxic,6I9VzXrHxO9rA9A5euc8Ak,"dance pop, pop"
One Step At a Time,5o4W6yWSJD9e9Ea8YC9WjF,"dance pop, pop, post-teen pop"
Bet On It,4EnwhEyuVrC1CgvSur5YL4,movie tunes
The Underdog,2ZLL9Blx7Tq4tBrhE9YvXE,"alternative rock, austindie, indie rock, modern rock"
Make Me Better,0YkJU6TjjwzsVXUPRIO0DB,"gangster rap, hip hop, pop rap, rap, trap, urban contemporary"
15 Step,4oXg7xT4ksBxHTx8PcmSXw,"alternative rock, art rock, melancholia, oxford indie, permanent wave, rock"
Missed the Boat,4asjU3sDnn3002bTJIg2vZ,"alternative rock, chamber pop, indie rock, indietronica, modern rock, washington indie"
Little Wonders,6j6bTAiW0oEfLlAjmRNcbb,"neo mellow, pop rock, post-grunge"
The Bird and the Worm,6tKky3l379dnGe7F85ztrJ,"alternative metal, neon pop punk, pop emo, post-grunge, post-hardcore, screamo"
Makes Me Wonder,1lHXlGlve5Zx8tXLhyjDwM,pop
Destination Calabria - Radio Edit,5TmFTHZp7HjBXjjsFvCY6h,"disco house, italo dance, vocal house"
Pasarela,4Ak3nD2e2RHj9aaYrwlRTp,"latin hip hop, reggaeton, trap latino, urbano latino"
Untouched,0KlahhzNb98zyN83Vwae0l,"australian pop, candy pop, dance pop, girl group, post-teen pop"
Just Fine,33vzOPcd9FRirYGlCu32x4,"dance pop, hip pop, neo soul, r&b, urban contemporary"
Lead Me To The Cross,7i2ZmmyLzE7NcFAJl30mKY,"ccm, christian music, world worship, worship"
Remember Everything,4KULAymBBJcPRpk1yO4dOG,"classic oklahoma country, modern country pop"
Flashing Lights,5TRPicyLGbAF2LGBFbHGvO,"chicago rap, hip hop, rap"
Ayo Technology,36Hwcla06Q5BCr59CL0sBp,"east coast hip hop, gangster rap, hip hop, pop rap, queens hip hop, rap"
The Way I Am,23wfXwnsPZYe5A1xXRHb3J,"detroit hip hop, hip hop, rap"
Take It Easy - 2006 Remaster,1UEKaf3j6eXeNbySz761lc,"contemporary country, country, country road, outlaw country"
Love Like This (feat. Sean Kingston),49ppqF73rOz5Nyt1paRxIF,"dance pop, pop, post-teen pop"
Reckoner,02ppMPbg1OtEdHgoPqoqju,"alternative rock, art rock, melancholia, oxford indie, permanent wave, rock"
Gotta Go My Own Way,5rWIO1uP0GwAoU45RTBJ2F,"hollywood, movie tunes, post-teen pop"
Shake It,5xTtaWoae3wi06K5WfVUUH,pop
Cowgirls Don't Cry,76fUOrKOcUnAceODDPBidy,"contemporary country, country, country road"
Conteo Regresivo - Salsa Version,37nXsqE1XW0cxOQvIMsmFc,"salsa, salsa puertorriquena, tropical"
Find out Who Your Friends Are,73njvNJmgXA180vTPkA16C,"arkansas country, contemporary country, country, country road"
Bodysnatchers,4pWIwnnqx8k01fuF95UMIg,"alternative rock, art rock, melancholia, oxford indie, permanent wave, rock"
Para Siempre,0xvaM53zDst3zcIpcNc37M,"reggaeton, urbano latino"
Cyclone (feat. T-Pain),0x1LCpY9Rgeq97VPajm81B,"chicano rap, latin hip hop, pop rap, southern hip hop, texas latin rap, urban contemporary"
Good Night,3bhyo2ED5Yd4RLydQBDtD6,"chicago rap, hip hop, rap"
Don't Blink,6reuJxDtjebwc9FB6rNpp0,"contemporary country, country, country road, modern country rock"
Wait for You,0U969xYNlAyfzi8P1TaO7u,idol
Better in Time,2iXBZ32Fz5VDCLeE0JIdX5,"british soul, dance pop, pop, talent show"
"Sugar, Sugar",6MTd61g9zq6CB1FnJydjEb,"bubblegum pop, classic canadian rock, rock-and-roll"
New Soul,476JcJ3TpAuCOlGdCmomGm,folk-pop
Starting Over,3K07bGe8iljQ3mOKArHLDo,"contemporary country, outlaw country"
Aparentemente,1wYFvhxzKJ8W3B8TM0Ag2k,reggaeton
Hold On,2aSC2xhRxOLiiZZVjhbylH,"canadian hip hop, canadian pop, hip hop, pop rap, rap"
Drunk and Hot Girls,7DRuzSlhjKadgdsQRYZ0tr,"chicago rap, hip hop, rap"
Notorious Thugs (feat. Bone Thugs-n-Harmony) - 2007 Remaster,1ozdRCYFVt8Ui0dba1520D,"east coast hip hop, gangster rap, hardcore hip hop, hip hop, rap"
Cry for You,1mvZErZBp7WZT3HfGBykao,"swedish electropop, swedish pop"
Dream Lover,5XeUMqS6mpTEspPgd5TLtg,"adult standards, easy listening, lounge, rock-and-roll, vocal jazz"
Suffocate - Superclean,3nJjIYchBNkYm7B8XfJf5N,"contemporary r&b, hip pop, r&b, southern hip hop, urban contemporary"
Throw Some D's,6SmPPtaMnfxgz5duA6t9Cu,"alabama rap, dirty south rap"
3's & 7's,63wsuMhok6GgcBRd2strGk,"alternative metal, alternative rock, grunge, modern rock, nu metal, palm desert scene, rock, stoner metal, stoner rock"
Solo Un Dia (Ahora Te Amo),51RcAoNIqe0G3284yxT8G0,"banda, musica mexicana, norteno"
Carrion,0xfWKcNu13xxXQ2GT0P09M,"alternative metal, australian metalcore, melodic metalcore, metalcore, nu metal"
Attention Span,7z3EXUkDIgi6y3L46JSklf,reggae rock
Runnin' Wild,71fSn6OIF7HnCbgCzOBqpj,hard rock
My Axe,21DhGvrfC9W2FBjW5EJmWE,"rap rock, viral rap"
Hosanna,5VlojXyAGM1q9ke2ybxrVT,"ccm, christian music, world worship, worship"
Becoming the Bull,2MMrjobPrVLrozyfFXsFJx,"alternative metal, melodic metalcore, metalcore, nu metal, pop punk, post-grunge, screamo"
Last Name,44xWtabQzBHKXxD0UVLSNQ,"classic oklahoma country, contemporary country, country, country dawn, country road, dance pop, pop"
"Happy Working Song - From ""Enchanted"" / Soundtrack Version",6oNKXDX7bpzkXohQdd0MLc,movie tunes
Yakety Yak - 2007 Remaster,3Lbxie6whOW4eMt4jtI32k,"doo-wop, rhythm and blues, rock-and-roll, rockabilly"
Rise Above This,4dZ4iHhsqQAQ4em4abLB6C,"alternative metal, nu metal, post-grunge, south african rock"
No One's Gonna Love You,2IvNxLl01CTAfCOA103Tgx,"chamber pop, indie folk, indie rock, indietronica, modern rock, stomp and holler"
Te Quiero Igual Que Ayer - Bachata,1YrZktczkzn59XaWXMCYY2,"bachata, bachata dominicana, tropical"
Black Magic Woman,4YMQXzscifAREG0a7KNGhB,"blues rock, classic rock, mexican classic rock"
Tu Eres Ajena - Bachata,64zjvItFmkY8Q96tcmGQ6n,"bachata, bachata dominicana"
That's Just The Way We Roll,0EsjWfC9lJiAZAHe5sMqGt,"boy band, pop"
The River,3gQC0KTBXZeysuzRqMrfbD,"ccm, christian alternative rock, christian indie, christian music"
I Tried,2elA6JLRaQ6iB7hxiuTKN4,"gangster rap, hardcore hip hop, hip hop, ohio hip hop, rap"
Juan Martha,0FG2BidxWdYecUegaWAnST,"banda, musica mexicana, norteno"
ChuChu Lovely MuniMuni MuraMura PrinPrin Boron Nururu ReroRero,4vLhi74fctCnK4OFbiiS6P,"j-metal, japanese metalcore"
Laughter In The Rain,2ozTcQyZQmm9tSmc4VZfwU,"adult standards, brill building pop, bubblegum pop, easy listening, rockabilly, soft rock"
Safe and Sound,6Z8R6UsFuGXGtiIxiD8ISb,"metropopolis, modern rock"
I Don't Care,3HVWdVOQ0ZA45FuZGSfvns,
No More Sorrow,4CWhc9FaMMfBTt4ANjfbOf,"alternative metal, nu metal, post-grunge, rap metal, rock"
Brave as a Noun,6bfPo8Ge3VoD4dEGSDs0R9,"acoustic punk, anti-folk, folk punk, pov: indie"
Desmadre en el Bano,639HHMIvPddNffAgYylJcL,"musica mexicana, norteno"
Ayer Te Vi... Fue Mas Claro Que La Luna,636y223sbqgNNVeH7s5qkp,"latin christian, rock cristiano"
Whatcha See Is Whatcha Get,5lYpHO6ZO4Shys3GD8rav6,"classic soul, disco, funk, memphis soul, motown, p funk, post-disco, quiet storm, soul, southern soul"
Rock Yo Hips,76dZuMVXjIyLPRLv00skGd,"atl hip hop, crunk, dirty south rap, old school atlanta hip hop, southern hip hop"
Friday,263aNAQCeFSWipk896byo6,"new wave, permanent wave, rock, uk post-punk"
"For a Pessimist, I'm Pretty Optimistic",2PDLmgDWiwjUTxl1pPyDQA,"candy pop, modern rock, pixie, pop, pop emo, pop punk, rock"
Murmaider,5ghMfHMHakVS0omjj2cBSA,comic metal
"""The Take Over, The Breaks Over""",3rG8ZkmKHb4Ms6CsSzEITv,"emo, modern rock, pop, pop punk, rock"
Se Fue,6Yard5LK4aXEn0kBKtHSob,"musica mexicana, norteno, sierreno"
Me Enamora,5BY0p2EH4EznNZ0MFD9mjt,"colombian pop, latin pop, mexican pop, rock en espanol"
Upgrade U (feat. Jay-Z),0GLUBbX4daHJkT3RQHEOia,"pop, r&b"
Chuy Y Mauricio,04xO1gevudj8k7y2wTGTjC,"banda, corrido, musica mexicana, norteno, sierreno"
La Derrota,5kYjvOHOQtPoeKLHbN35rU,"mariachi, ranchera"
Greed,3rUGC1vUpkDG9CZFHMur1t,"alt z, pop"
This Is Why I'm Hot,4Js2MCBgl8wupEjKewj0kT,
Dos Locos,3mx8WfEOjeUB1a0fpFxQmi,"bachata, bachata dominicana, tropical"
Tattoo,1XcxubL4Y4U4gxLeIbb8VM,"kentucky indie, kentucky roots, outlaw country"
Le Festin,02JIdsrod3BYucThfUFDUX,"chanson, nouvelle chanson francaise"
Fences,4aICBAAFGF3pLSZDlmsMj9,"candy pop, modern rock, pixie, pop, pop emo, pop punk, rock"
5 Letras,0tDSgSmZsbxCkdkfUPjg59,"latin hip hop, reggaeton, trap latino, urbano latino"
"So Close - From ""Enchanted""/Soundtrack Version",3XFkhxO5jo2hBOWNzIQ9UB,"acoustic pop, indy indie, neo mellow, piano rock"
Make It Wit Chu,0Cgd3CK6D2hhbwmLRvtscH,"alternative metal, alternative rock, grunge, modern rock, nu metal, palm desert scene, rock, stoner metal, stoner rock"
Critical Acclaim,4VymMhILk4DSwghPkLUPVS,"alternative metal, nu metal"
D.A.N.C.E,33yAEqzKXexYM3WlOYtTfQ,"alternative dance, dance-punk, electronica, filter house, indietronica, neo-synthpop, new rave"
Yeah Boy and Doll Face,51rIDh0FOCNCFkdbtIOyU0,"pop punk, screamo"
Johnny Cash,7C2Th9WKovi6NyjGoqaPsK,"contemporary country, country, country road, modern country rock"
Piece of Me,2EvwLVrnYbCZEG6Kx5DCRy,"dance pop, pop"
Believe,0pqnGHJpmpxLKifKRmU6WP,"modern rock, pop, rock"
Hey Si Me Ven,1dndIoArEd9c27oqi4Wqmd,"latin hip hop, mexican hip hop"
Coming Down,3mHO1J6kfiArjBo1zhLFGP,"canadian contemporary r&b, canadian pop, pop"
Quizas - Remix,4YFoQUkj0XXJgTiHp8d61y,"reggaeton, urbano latino"
Mil Heridas,42QrQFst462IHFXR19hxZQ,"banda, banda jalisciense, musica mexicana, norteno"
I Am A Gummy Bear (English),5YJfmBODXO0lL2zTDf8xlD,cartoon
Calabria 2007 (feat. Natasja) - Radio Edit,49ou9vBZLTCi4TYoYzR3F9,reggae fusion
Juicy - 2007 Remaster,2b7FqlHc3JrzlYtGEkzq22,"east coast hip hop, gangster rap, hardcore hip hop, hip hop, rap"
I Remember,4KULAymBBJcPRpk1yO4dOG,"classic oklahoma country, modern country pop"
Keep Holding On,4UPcXTh26ilb7owtuyHqNI,"canadian pop, candy pop, pop"
Remembering Sunday,2qxXypNXOJZ5qUFdpzJ56n,"modern rock, neon pop punk, pop punk"
La niña fresa,3sgHiiSR5V8V97FiQtne0u,"banda, grupera, musica nayarita, tecnobanda"
Wall To Wall,6IgFFnT7ikUWvFSjzxNf0S,"atl hip hop, melodic rap, rap, trap"
I Get It,3K8hcmiEnCiVFqqHoMMz4q,"alternative metal, christian rock, nu metal, post-grunge"
