Song Name,Song ID,Genres
Yo Te Amo,4pcfClALXncqded14gYRVF,"grupera, musica mexicana, ranchera"
The National Anthem,4Wgj6jzoI2gYlumXdYAB8U,"alternative rock, art rock, melancholia, oxford indie, permanent wave, rock"
My December,0fxGA5lxrdYNYoE7yJxTNZ,"alternative metal, nu metal, post-grunge, rap metal, rock"
Luven Me,0ptmBzEt6qslc4G5Iw0Y0E,"dance pop, gangster rap, hip hop, pop rap, rap, st louis rap, urban contemporary"
Bamboleo,5siwoDxCGDYnmfWV5SlUpE,"flamenco, rumba, world"
Until We Rich,6l3b8BOBDRDM1ne9fpOygz,"conscious hip hop, g funk, gangster rap, hip hop, rap, west coast rap"
Send It On,5LIwaG8Wl9LfExcmiRQm7J,"indie soul, neo soul, soul"
Spit,1N8TTK1Uoy7UvQNUazfUt5,bedroom r&b
Optimistic,1FoUsSi9BCTlNt2Vd7V8XA,"alternative rock, art rock, melancholia, oxford indie, permanent wave, rock"
Bitches,5t3Vk8bRKylx4fjj7qlbib,"art pop, electropop, pop"
What'chu Like (feat. Tyrese),5d8woPn6sHRA6yPnnHnqSt,"chicago rap, contemporary r&b, dirty south rap, hip pop, new jack swing, r&b, urban contemporary"
Boyz-n-the Hood,5RGXoZt1qxmAErdhbyKJKq,"g funk, gangster rap, hip hop, rap, west coast rap"
Alma De Acero,3LgQlKNGiQiQhMiTU0ZKao,"cumbia sonidera, grupera, musica mexicana, tropical"
How Many Licks? (feat. Sisqo),5jv3QxL0MFswzM1UJ2qQJM,"dance pop, east coast hip hop, hip hop, hip pop, pop rap, r&b, rap, southern hip hop, trap queen, urban contemporary"
Elite,3jnYlchDDAiLzfkPPy12ig,"alternative metal, nu metal, rap metal, rock, sacramento indie"
Street Carp,5qNr7GnEmD3zA2oQTAdI3a,"alternative metal, nu metal, rap metal, rock, sacramento indie"
Too Young,4SYUUlkScpNR1QvPscXf8t,"dfw rap, melodic rap, pop, rap"
Parachutes,4qzoHxgp42ylb18ga1SWTL,"permanent wave, pop"
Feiticeira,0FpYnuKYFJXHAmHbS1CycY,"alternative metal, nu metal, rap metal, rock, sacramento indie"
Didn't Leave Nobody But The Baby,7ESCrKC98mNhYZY9AenRMQ,"country rock, folk, lilith, melancholia, singer-songwriter"
Never Had A Dream Come True,0fIG0HBRIjLRNDHAogtwSB,"europop, talent show"
Prometimos No Llorar,3TSJgodP7iM95y0kODUSyp,"cancion melodica, mexican rock-and-roll, pop romantico, ranchera"
Bad Day,0mUyMawtxj1CJ76kn9gIZK,"canadian pop, neo mellow, pop rock"
El Gato Que Está Triste y Azul - Un Gato Nel Blu,3SrnZHhXpgtvHerbxEDOWW,"jovem guarda, mpb"
Island Girls-feat. Fiji & O-Shen,3PInFWTaErSbJd08iSVsyd,jawaiian
Back Here,6znv7i4Wif5fLwI6OjKHZ4,boy band
Since I Left You,1AAYbsAIgEJMbxgLgpjE9y,"australian alternative rock, australian dance, collage pop, electronica, indietronica, new rave, psychedelic hip hop"
"Symphony No. 25 in G Minor, K. 183: I. Allegro con brio",409nw0mYViQATvGlJnz3Tu,"classical, classical era"
Whistle While You Twurk (ColliPark Mix),1LMAQunVS6Dq8wEqQnsL8Y,"atl hip hop, crunk, dirty south rap, old school atlanta hip hop, southern hip hop"
Shadows of Ourselves,6Z1ezsoUv1yi8JHqL6bA69,"downtempo, electronica, livetronica, trip hop"
The Breakup Suite,3kXKHXZmaw57l7gu4Rn11x,slowcore
Fallen Embers,0lvcVCCEpjn9titFA3lSis,"celtic, middle earth, operatic pop"
The Game,2wGSgTmgSF3xjRrHkTc25R,"detroit hip hop, gangster rap, hip hop, pop rap, rap, southern hip hop, trap"
Radio,3QhfFRPkhPCR1RMJWV1gde,"art pop, pop"
Hello Walls,4dim8F8t01qimHOmr6S3Gd,"classic country pop, honky tonk, traditional country, western swing"
Ex-Girlfriend,5ECMRJbRlj0FZRg9cRg94m,"dance pop, dance rock, permanent wave, pop rock, rock"
You Send Me,24lvdbt9pS7DFEjhEWSl49,"classic soul, soul, vocal jazz"
I Feel Fine - Remastered 2015,5hhF25sWnZvXhimOHLjTRE,"beatlesque, british invasion, classic rock, merseybeat, psychedelic rock, rock"
"3 Pieces, Op. 2: Prelude in B Major, Op. 2, No. 2",7si7S7r2BQUfJIMhN2lJDO,"classical, contemporary classical, early modern classical, impressionism, late romantic era, russian romanticism"
One by One,1ueOEwIxlCAivSC8ZrA5xW,"celtic, middle earth, operatic pop"
Spies,2mLgOcRkEgq89j8WstUpui,"permanent wave, pop"
The Little Girl (feat. Alison Krauss & Dan Tyminski),572R9OVMyWKBeg1hOMgSsW,"contemporary country, country, country road"
Ghostbusters,3m0y8qLoznUYi73SUBP8GI,
Yesterday - Remastered 2015,4E5rL7YL0hVUPqeMSpjEF2,"beatlesque, british invasion, classic rock, merseybeat, psychedelic rock, rock"
Mi Ultimo Deseo,01ksPzu3Bw8Lsf9o6xIk8C,"banda, musica mexicana, norteno"
#1 Stunna,0DB5hjYLs8uL9KtE0immhi,"cloud rap, dark trap, new orleans rap, underground hip hop"
Teenager,7j31rVgGX9Q2blT92VBEA0,"emo, modern rock, pop punk, pov: indie, rock"
Ante Up (Robbin Hoodz Theory),550JPXXPgjr1xqxtKIaX6b,"east coast hip hop, hardcore hip hop"
All About Our Love,0TZOdKFWNYfnwewAP8R4D8,"british soul, sophisti-pop"
Korea,7cYKGj2j9AWNwQukTl2Jev,"alternative metal, nu metal, rap metal, rock, sacramento indie"
Flora's Secret,4UW5yJcnRrOtHdKOnBds7M,"celtic, middle earth, operatic pop"
Stupify,5IvKtrcNWBkvyW2yXZ2Y40,"alternative metal, nu metal, rap metal, rock"
Fill Me In,0UzsDmdpw0Q14KU4hieQss,"british soul, talent show"
Prayin' For Daylight,0DAVCurdi9ZqkVUKIuikzm,"contemporary country, country, country road, modern country rock"
Son Of Sam,6tPiCU4LFsXUQPRIykOAnl,"alternative rock, indie rock, melancholia, singer-songwriter"
Damn Right,3iWhMLg6OzisrOylR53bQf,
Warning,64SCQtbRtmO28ks1QhS3w5,contemporary country
Amorcito Mío,31UICcEejwN9HFOgbc17KS,"corrido, musica mexicana, sad sierreno, sierreno"
Frontier Psychiatrist,3mPJHVpCvzykoxmWnYdnFq,"australian alternative rock, australian dance, collage pop, electronica, indietronica, new rave, psychedelic hip hop"
Te Soñé,0hZgBAj7W0EkRH16feKmUu,"banda, musica mexicana"
Palabras,57xX3bw17BSVUu5WXGwoNw,"banda, grupera, gruperas inmortales, musica mexicana, norteno, ranchera"
El Moreño,0IZcLOevGQ6LYG9IV3w1gx,"banda, musica mexicana, musica sonorense, norteno"
Me Haces Falta Tú,0L2egVeSTDMt5YB5clmP9u,"gruperas inmortales, musica mexicana, nu-cumbia, ranchera, tropical"
The Days Of The Phoenix,7oSQG8KgYbrcR2kgwUD9SU,"alternative metal, nu metal, pop punk, post-grunge, punk, screamo"
Waiting,5imShWWzwqfAJ9gXFpGAQh,"neo mellow, singer-songwriter"
Just Be A Man About It,6kD36kVRn5leDDbjXpHQY0,"contemporary r&b, dance pop, r&b, urban contemporary"
Mastermind,7FmYn9e7KHMXcxqGSj9LjH,pop
Magdalena,47HJ7biEuVZxoPkauczu2R,"alternative metal, alternative rock, nu metal, rock, supergroup"
Chicka Chicka Boom Boom,3aCnWGT8DmlbpAV75McnZR,"children's music, preschool children's music"
Project Bitch,7jeuO70ZhwRuGbfH1laugD,"crunk, dirty south rap, new orleans rap"
Amorcito Mío,31UICcEejwN9HFOgbc17KS,"corrido, musica mexicana, sad sierreno, sierreno"
Frontier Psychiatrist,3mPJHVpCvzykoxmWnYdnFq,"australian alternative rock, australian dance, collage pop, electronica, indietronica, new rave, psychedelic hip hop"
Te Soñé,0hZgBAj7W0EkRH16feKmUu,"banda, musica mexicana"
"Dime, Dime, Dime",5bKwokLK8mbbClG0r8bYJx,"banda, musica chihuahuense, musica mexicana, norteno"
Palabras,57xX3bw17BSVUu5WXGwoNw,"banda, grupera, gruperas inmortales, musica mexicana, norteno, ranchera"
El Moreño,0IZcLOevGQ6LYG9IV3w1gx,"banda, musica mexicana, musica sonorense, norteno"
Me Haces Falta Tú,0L2egVeSTDMt5YB5clmP9u,"gruperas inmortales, musica mexicana, nu-cumbia, ranchera, tropical"
The Days Of The Phoenix,7oSQG8KgYbrcR2kgwUD9SU,"alternative metal, nu metal, pop punk, post-grunge, punk, screamo"
Waiting,5imShWWzwqfAJ9gXFpGAQh,"neo mellow, singer-songwriter"
Just Be A Man About It,6kD36kVRn5leDDbjXpHQY0,"contemporary r&b, dance pop, r&b, urban contemporary"
Mastermind,7FmYn9e7KHMXcxqGSj9LjH,pop
Magdalena,47HJ7biEuVZxoPkauczu2R,"alternative metal, alternative rock, nu metal, rock, supergroup"
Chicka Chicka Boom Boom,3aCnWGT8DmlbpAV75McnZR,"children's music, preschool children's music"
Project Bitch,7jeuO70ZhwRuGbfH1laugD,"crunk, dirty south rap, new orleans rap"
Y - En vivo,6QbEENozheS46xQY56acH9,"bolero, latin pop"
Weed Song,4gLro52WoEK40Y7CZn6mIK,"gangster rap, hardcore hip hop, hip hop, ohio hip hop, rap"
Murder On Music Row,2f8KUIjzOwzLWVF20DpD9A,"contemporary country, country, country road"
Carry You,0u4rkpmNtgcFxYHepnVF4v,"ambient folk, indie anthem-folk, indie folk, modern indie folk"
Cumbia De Los Estados,4n0kXy9VtZQnh1oOLIOQ6D,"cumbia colombiana regia, cumbia sonidera"
Space Cowboy (Yippie-Yi-Yay),0B7Hp8MXbiK8HoXqqYqTkW,"boy band, dance pop, pop"
Full Nelson,6YU556RBcA4js0poLlP8Cu,"alternative metal, funk metal, nu metal, post-grunge, rap metal, rock"
The Nobodies,1x8sna2LV8WQ38NEtN5X46,"alternative metal, hard rock, industrial, industrial metal, industrial rock, nu metal, post-grunge, rock"
She Loves You - Mono / Remastered,6nEkxYIEnrbYH7h1hJ8Xn6,"beatlesque, british invasion, classic rock, merseybeat, psychedelic rock, rock"
Cuándo,79gkHjNTSyGPXEyGkNQ8zH,"dance pop, latin pop, mexican pop"
"5 Preludes, Op. 16: IV. Prelude No. 4 in E-Flat Minor: Lento",6Xan47ZLZr9P8YEcOt3JaX,"classical, contemporary classical, early modern classical, impressionism, late romantic era, russian romanticism"
Baby Mine,4BU9s6QLGFCaxlgaPWWuFY,acoustic guitar cover
In Love With You,79UjqYt9MCLlBpzAvaKVJj,"afrofuturism, alternative r&b, neo soul, r&b, soul"
Let It Be - Remastered 2015,4qsVPnhbvEooD1bSNqvvh0,"beatlesque, british invasion, classic rock, merseybeat, psychedelic rock, rock"
My Love,3vkCueOmm7xQDoJ17W1Pm3,"brooklyn indie, pov: indie"
Love Speakeasy,6eXpxFGhRMssC5XnaxEhMu,alternative hip hop
Can't Fight The Moonlight,2AogRMqARWyUP7VQ3gmSoY,"country, country dawn, country road"
I'm Movin' On,7gpuC3rLKkI7PoJcEnSIO6,"contemporary country, country, country road, modern country rock"
Pitch In OnA Party,2hyyA7U1m1pFlZcEyl91jH,"g funk, popping, west coast rap"
Everything Reminds Me Of Her,3nkdVXnH4xC6f3YZS0C8pC,"alternative rock, indie rock, melancholia, singer-songwriter"
Voices,5XUuldRjPXcP5QxyEN4IXT,"alternative metal, pop punk, rap metal"
La Cobra,5OW5ozTTkRJEqJj7UZfAQc,texas latin rap
I Am A Man Of Constant Sorrow - With Band,6NfXJzeyMsV48pM6zegv0s,outlaw country
You Know My Name,0Dlm41iXvTsIVsEOce3yX6,"gospel, naija worship"
Bohemian Like You,3APHT3KjbHi9OllkVQsuXF,"alternative rock, dance-punk"
Doo Wop (That Thing) - Edit,5hchPe05atCRhAYTNJfxER,"alternative r&b, conscious hip hop, hip hop, neo soul, new jersey rap, r&b, soul"
For the Damaged Coda,6lvJDlBrtabJWiBlMTGxKs,"dream pop, indie rock, nu gaze, shoegaze"
Ho,3itgPtXSu4I9mr2QD6yrzP,"classic oklahoma country, modern country pop"
Me Gusta Tener De A Dos,3bMOC3Ty5qayPUz79CTNY6,"classic sierreno, corrido, corridos alternativos, corridos clasicos, norteno"
House at Pooh Corner,1AieZp5vImnCvbUapUyoFG,piano cover
The Galway Girl,1KnilWyiAb1Jwa9QJXZGMN,"alternative country, classic texas country, country rock, folk, heartland rock, outlaw country, roots rock, singer-songwriter"
Si Tú Me Dices Ven (El Lodo),18jpbSZVA950uq9JiwahHQ,"bachata, bachata dominicana"
Music,5LYMamLv12UPbemOaTPyeV,pop
Trial Time,3SMDkLZ0dVlb6rQFyMoX5k,alabama rap
El Plebe y el Cholo,2jR8SDgmlxxxsiJ2iwd6Ms,"corrido, musica mexicana, norteno"
El Dia Que Me Muera,2zukPzVOhWrPIKm2yf3DXA,"musica mexicana, norteno"
Hit Or Miss,2JGfAzStXQ1VEo6H4l6rSR,"easycore, neon pop punk, pop punk"
Go Get It,2gPl93XdGnfKUykwxVHUYt,"atl hip hop, dirty south rap, gangster rap, hip hop, pop rap, rap, southern hip hop, trap"
ABC,0qCPD6ilr9nXkI4KVZgcns,"corrido, sierreno"
Now We Are Free,6k41naacsmD4L3i9AzCFom,"german soundtrack, orchestral soundtrack, soundtrack"
Bailando Con El,6YhrPNvIJga1ACuEmsyaPO,"bachata, bachata dominicana"
Stabilisers For Big Boys,7AIRXaWc2HPUvIqJ19IbtU,diy emo
The HampsterDance Song,0ouSkB2t2fGeW60MPcvmXl,
La Gallina,5VKELcHc3xqRq0tySxMVrB,gruperas inmortales
Yo No Fui,0SygIagLM5nPX3qWvh53UY,"mariachi, ranchera"
One Armed Scissor,4QYg0pee8jcGTHC3Uh2Vii,"dance-punk, el paso indie, emo, garage rock, post-hardcore"
Kid A,5rX6C5QVvvZB7XckETNych,nu metal
Hello Operator,7zPxIh1c3kJaNwmjdZ3GQX,"alternative rock, blues rock, detroit rock, garage rock, modern blues rock, permanent wave, punk blues, rock"
Brahms' Lullaby ( Someone To Watch Over Me ),3bgL0rJAAOAVJxYzQ9TN8a,piano cover
Cure for the Itch,3rpnfXSECgapxeGeRgUYqy,"alternative metal, nu metal, post-grunge, rap metal, rock"
Come Pick Me Up,0lngUitwRDbvZ5yVO76dVN,"alternative country, new americana, roots rock, singer-songwriter"
Remember Me?,630Ug0XtmhhFvAKo0PNuEI,"alternative r&b, bedroom soul"
Eleanor Rigby - Remastered 2015,0Wv8IXRUDZOfmFJHC1VOFI,"beatlesque, british invasion, classic rock, merseybeat, psychedelic rock, rock"
Let A Killa,6QKRGElmAeBTNmZFsULMPw,
Fools Rush In,1POSSxzIB7fLcHDDfbmjDZ,background jazz
Family Tradition,73ZTWCuwudUVvvWipRnQnQ,"country, country rock, outlaw country"
Everything's Not Lost - Includes Hidden Track 'Life Is For Living',1RNtm45kw0hPMBz7gKiIYu,"permanent wave, pop"
When You Come Back Down,1xVBmHH65VMaJP61SmOSUk,"bluegrass, instrumental bluegrass, mandolin, progressive bluegrass"
Loose,59acp1OhcvxwVBwQJBYKuX,canadian contemporary r&b
Amityville,0erTM8A9ro5kzcNc962jHd,"detroit hip hop, hip hop, rap"
Everything,3ZCTVFBt2Brf31RLEnCkWJ,"art pop, electropop, pop"
Duck And Run,0s8OsDxW96cl290PcsI2mX,"alternative metal, nu metal, post-grunge, rock"
"Best Of Me, Part 2",1faidjbURmhACFeCjhxSu9,"contemporary r&b, hip pop, r&b, urban contemporary"
Ms. Jackson - Radio Mix,0AU0VWpaoihPEvxly76JVf,"atl hip hop, dirty south rap, hip hop, old school atlanta hip hop, rap, southern hip hop"
Best of Intentions,7v3BvPRQS4DcsDzYU0BiVd,"contemporary country, country, country road, outlaw country"
Love of a Woman,7dVINsv6faqqTUelZdvd5U,"contemporary country, country, country road, outlaw country"
Secret Lovers At the Heaven's Gate Ranch,7tpzFMjC36091aRE48Y2FN,"emo, gainesville indie, midwest emo, screamo, skramz"
Pero Me Acuerdo de Tí,4B1sb2YVO03sBmyR8bvzEB,"dance pop, pop"
Can't Give Up Now,5xxnE0Nm5v3L9tekNEWpCg,"gospel, gospel r&b"
Never Ending Math Equation,0iyvEYrbUWOa2eMcj4XuGz,"alternative rock, chamber pop, indie rock, indietronica, modern rock, washington indie"
Blast,7dH9TPjTWQ60wOJkmYay8a,pop rap
Stand Inside Your Love,3RciEQxS7PxtLqMs7OwRsU,"alternative metal, alternative rock, grunge, permanent wave, rock, spacegrunge"
La Cabrona,2UItG0wkLz4gd8ul5sSanz,"banda, musica mexicana"
She Bangs - English Version,1uPrIHgYztXSkkcts9jet8,"latin pop, mexican pop, puerto rican pop"
Un Montón De Estrellas,2Xg030uYjEA9FNiSKbD3R8,"salsa, salsa puertorriquena, tropical"
Broke,2fXwCWkh6YG5zU1IyvQrbs,"pop, r&b, rap"
Apple Blossom,5Z10YWrfpP2UAUwmmHIR8y,"alternative rock, blues rock, detroit rock, garage rock, modern blues rock, permanent wave, punk blues, rock"
You Can Have It All,5s91S8hSrJXqYdhwHOEioV,"alternative rock, art pop, dream pop, indie rock, indietronica, lo-fi, new jersey indie, noise pop, permanent wave, shoegaze"
Bathwater,3xbZU7KENdHZrX99VDNGwx,"dance pop, dance rock, permanent wave, pop rock, rock"
Redeemer,60voQIiwEp0n6H7Qhu6AwH,"ccm, christian alternative rock, christian music, classic praise"
Tilt-A-Whirl,21cjO5aPRhXdTwpsbARh0f,"rap rock, viral rap"
Llora Alma Mía,6KioOiN7xTcjhlYC88qkgb,"bachata, bachata dominicana"
South Texas Deathride,4DenxoUslmyLJB5vzurCBD,"alternative metal, industrial metal, nu metal"
St. Louie,1jzZxOYrhSgowlEbc22JBF,"dance pop, gangster rap, hip hop, pop rap, rap, st louis rap, urban contemporary"
American Beauty,7K36drJq6lInkW6Kkojucp,"acoustic pop, stomp and holler"
Orestes,6YUKAH1icwkA3U7fVp3amo,"alternative metal, alternative rock, nu metal, rock, supergroup"
God in Me (feat. Kierra Sheard),1ZxwWrMNukjS8sb9TZ0HjU,"gospel, gospel r&b"
You,5W4kiM2cUYBJXKRudNyxjW,contemporary country
Paris,6tO5bxNnMuh1c3cziSpecA,"cloud rap, dark trap, new orleans rap, underground hip hop"
Maggie's Farm,2t0tVmiSkHWvKgojpjO21Z,"alternative metal, alternative rock, conscious hip hop, funk metal, hard rock, nu metal, political hip hop, post-grunge, rap metal, rap rock, rock"
Rie y Llora,63knvuoSPpfzIwdDuWRSoV,"cha-cha-cha, cuban rumba, mambo, musica tradicional cubana, salsa"
Salty Dog,5cttYnhe480emw7rofGZQ6,"celtic punk, celtic rock, punk"
Hotel California (Spanish Mix),4Rvhe8O90hFIExTJkdrRPM,"flamenco, rumba, world"
Get Another Boyfriend,3nx5PkGa2sJyXVJzqE4eYM,"boy band, dance pop, pop"
Lone Ranger,0WyyDFJ2MNwHUQTWdlTERR,
Grab The Devil By The Horns And **** Him Up The ***,3n587eraSHnJmCsgQOCVca,"alternative metal, canadian pop punk, canadian punk, modern rock, nu metal, pop punk, post-grunge, punk, rock"
Déjame Amarte,5tzBmQr9EopzbPQjiMGFmK,"banda, musica mexicana, norteno, tejano"
I Could Not Ask for More,3TcoHf7nvC8RaDVdfIFjFR,"contemporary country, country, country dawn, country gospel, country road"
Don't Aproach Me (feat. Eminem),0Bb21NEv7yjSJ8ro2k2SZC,"detroit hip hop, g funk, gangster rap, hardcore hip hop, hip hop, west coast rap"
Treat Her Like A Lady - Single Version,71EMeSBrRJjWMJ314mPayo,"memphis soul, motown, soul"
A Puro Dolor,28upjDakWVnHAgW2anm273,"puerto rican pop, tropical"
Digital Get Down,0yX0Zw8ouA5lD7rbzWfowL,"boy band, dance pop, pop"
Polka Dots And Moonbeams,0HFWS5C6ThNeuOr10Xz21U,"adult standards, big band, dixieland, easy listening, jazz trombone, swing, tin pan alley, vintage jazz"
El Afilador,7ob6SovekT6cESeyUHiFQn,cumbia sonidera
Jardin d'hiver,45gpJxviKRBsQo1lDZ03Xf,"dutch pop, nouvelle chanson francaise"
Noches de Fantasía,6r4EpLVNrajnIXmY9BgtgC,merengue
Ride Wit Me,3Gf5nttwcX9aaSQXRWidEZ,"dance pop, gangster rap, hip hop, pop rap, rap, st louis rap, urban contemporary"
Uptown Girl - Radio Edit,2sFp6E7lNBbblJGmUtCfFH,boy band
Bonnie & Shyne (feat. Barrington Levy),0UmIdWRGDL5gkXnqG9ZozM,"gangster rap, hardcore hip hop, hip pop, jewish hip hop, southern hip hop"
Gotta Tell You,1rj0XawWJNisX7SGYexowJ,"europop, talent show"
Barre Baby (feat. Ronnetta Spencer),1NVv0XLVxypQEuoQa4bjAQ,"chopped and screwed, dirty south rap, houston rap"
La Carroza Negra,2PiNsETKPfNKcZa23ruCay,"corrido, musica mexicana, norteno"
High Voltage,5pLgH1bCkBV3bbmvm0qvom,"australian rock, hard rock, rock"
Fear of Dying,30NCaDbTGyUJKTMrQwgXQG,alt z
A Teenager's Romance,1Qn5jElT7XqjvVeJ8pYM2w,"adult standards, doo-wop, rock-and-roll, rockabilly"
Promise,08PdFBcXzpkn1cWNgmKqhn,gen z singer-songwriter
Faded,698ItKASDavgwZ3WjaWjtz,electro house
Treefingers,4LrfsgQ5AGouvH3PlxW2PC,"alternative rock, art rock, melancholia, oxford indie, permanent wave, rock"
Here I Am (Come And Take Me),6YR2MkzMhojHBmW1TbXtZO,"reggae fusion, uk reggae"
Pa' Todo el Año,3O8QuZZrZF9aDYlmmClMO6,"mariachi, musica mexicana, norteno, ranchera"
Bag Lady - Cheeba Sac Radio Edit,7uAL8lsESR9Nl03BzHlKhF,"afrofuturism, alternative r&b, neo soul, r&b, soul"
Tamally Maak,6TYFcqqQVQPb3YsgfRhvqs,"arab pop, belly dance, egyptian pop, persian pop, rif"
Any Other Name,33B1XmfncHqnfkrYZIcHbD,"orchestral soundtrack, soundtrack"
Coffee Cold,6MN6yRVriszuyAVlyF8ndB,
Paperback Writer - Remastered 2015,0Ui8KPWZbJJQ2Y0CIQuVqX,"beatlesque, british invasion, classic rock, merseybeat, psychedelic rock, rock"
In The Fade,4KGdFDc2InqRHYCZt4svYc,"alternative metal, alternative rock, grunge, modern rock, nu metal, palm desert scene, rock, stoner metal, stoner rock"
Time's A Wastin,6q8fYYujrQxXckq1tTtqqi,"afrofuturism, alternative r&b, neo soul, r&b, soul"
Yesterday Don't Mean Shit,0MT298VrmI1Kb7GFbxw43C,"alternative metal, groove metal, hard rock, metal, nu metal, old school thrash, rock, texas metal"
New Disease,5xqi4X6J5PHwndSJc7YLYH,"alternative metal, groove metal, industrial metal, nu metal, rap metal"
L.A.,5h2nC1QYVpK0AJra70Ja3p,"dance pop, pop"
This Mess We're In,3vNFsxBbA4dPkymPF5Jm1b,"alternative rock, art pop, melancholia, permanent wave, piano rock, singer-songwriter"
Thank You For Loving Me,577MNC3o3L0lNIzx9abqOk,"glam metal, rock"
Haste Que El Cuerpo Aguante,5Q2uU5NGcS0mKwmgF28kRZ,"celtic metal, medieval rock, rock en espanol, spanish folk metal, spanish metal"
"Elysium - From ""Gladiator"" Soundtrack",7snyEEkuqPgQoJApi3iQ50,"german soundtrack, orchestral soundtrack, soundtrack"
"Turn Me On ""Mr. Deadman""",3pS1o7AFco7QrjfkOHFYdI,"alternative metal, industrial metal, nu metal"
Pull Over,6M33HiUHLC3R3gfXYNGMAy,"contemporary r&b, dirty south rap, hip pop, miami hip hop, r&b, rap latina, trap queen"
CUT,4LFBVDJV0xpayUvquQVzhS,"alternative metal, nu metal, post-grunge"
Maldita Seas,6JQtbDWCFIxtoLKCG1At9t,"banda, musica chihuahuense, musica mexicana, norteno"
13 Angels Standing Guard 'Round The Side Of Your Bed,7jbLjvNlKbfCRUoFWKo5TR,"canadian post-rock, post-rock"
Where I Come From,07pkQLjLQFFukRAYHSgoxX,"contemporary country, country, country road"
Dancing in the Moonlight - 2001 Remix,1OzY7RRZh3EcIKn7VKZUTx,british alternative rock
Por Qué Nos Dijimos Adiós,1U50yJZvm9My8sQHQBjSAd,"musica chihuahuense, musica mexicana, norteno, norteno-sax"
I Believe in You,1PpbrbgsXRXeKw1GnZMEv7,"classic country pop, country"
Cleva,1GoTvQP3JEeA8oh5I9b2xc,"afrofuturism, alternative r&b, neo soul, r&b, soul"
Crossing Muddy Waters,3qqgZJRKoi4oRva6eCrCC4,"country rock, folk, heartland rock, roots rock, singer-songwriter"
Sleepwalk,1IPHnu3hVkawJMzkP97tcm,dreampunk
So Com Voce,4720QgLxfScGStvX9YcGkA,"downtempo, electronica, livetronica, trip hop"
Hold On - Single Edit,6ZEH41nhWFoVbNZxHb24Ji,"girl group, mellow gold, new wave pop, soft rock"
Mayonesa,5Qjx4obghhfhsh6DiUwpNM,cumbia uruguaya
Can't Buy Me Love - Remastered 2015,38Vb1J5W5LOs0i7SAF76pa,"beatlesque, british invasion, classic rock, merseybeat, psychedelic rock, rock"
Slang Blade (feat. Senim Silla),7Hulh4egjeFaX7vroja3Q7,"alternative hip hop, conscious hip hop"
Do You Think I'm a Whore?,5aC8oD7sCinWSLO1xFJ9H8,"alternative metal, canadian metal, industrial metal, nu metal"
A Hard Day's Night - Remastered 2015,1pctwlBtIcKIjQMzsVcGHB,"beatlesque, british invasion, classic rock, merseybeat, psychedelic rock, rock"
Mary Go Round,1ix7ZmDu6LAOjriSvMAVlr,"chicano rap, latin hip hop, texas latin rap"
"Paganini: 24 Caprices, Op. 1: No. 24 in A Minor",6cC6h5E351deEGFd7Kh9uy,"classical, early romantic era, italian romanticism"
Mad Season,3jZHJO0QAb8sbv71DXOD9J,"neo mellow, pop rock, post-grunge"
Unrecovery,2ErXmhhd2r0oPYaMKi6BRV,slowcore
Sigue Sin Mi - En Vivo en Puerto Rico - Teatro Bellas Artes /2000,36HKwu77dVQNK6xbkNuueg,"grupera, latin pop, musica mexicana, ranchera"
Try Again,6Wnlq1Pu3I0BajLvxn05Vr,"contemporary r&b, dance pop, hip pop, r&b, urban contemporary"
Charlotte,7fa0BTUcbRmBRqIB4NaaEm,
Te Hice Mal,6quZpYdZlnArGrhOMyhc22,"grupera, musica mexicana, ranchera"
Simple Kind Of Life,3CY7wjLc1CaAIrp9buEWhG,"dance pop, dance rock, permanent wave, pop rock, rock"
Wu-Tang Clan Ain't Nothing Ta F**K Wit,66ZZ9lN9KKiA8zplDXM7GX,modern alternative rock
The Ghost of Tom Joad,3CCf4QWbFngXoIO1cLTj1L,"alternative metal, alternative rock, conscious hip hop, funk metal, hard rock, nu metal, political hip hop, post-grunge, rap metal, rap rock, rock"
More Than That,4XRUKxDIn28c7uHEzbGFgj,"boy band, dance pop, pop"
Voices,5XUuldRjPXcP5QxyEN4IXT,"alternative metal, pop punk, rap metal"
Alors on Danse Slowed,6TL3TJgpdWA4QFjZaK5EOg,"slowed and reverb, sped up"
You Are The Living Word (Live),5X2jIyGY95YNF3kmeOg1V1,gospel
Little Red Rodeo,166uOnqKj9iSOp4GYqoDOj,"contemporary country, country, country road"
Back Where You Belong - Edited Version,0YQeuXoLAK7WM2E8sswDdS,"album rock, classic rock, country rock, glam metal, hard rock, mellow gold, rock, soft rock, southern rock"
Lucy Pearl's Way,6yHi0vuRfBZb0aOqjU5L1D,"contemporary r&b, neo soul, new jack swing"
La Malagueña,3ffFEGNAioJPjFYAruekiT,"bolero, mariachi, ranchera"
Dancing in the Moonlight,0q21FNwES2bbtcduB6kjEU,soft rock
Sodium Chloride,7aafGSa6JccYOY9kNV9FNB,diy emo
Tonight May Have To Last Me All My Life - MF DOOM Remix,1W3KDVgbH65G1FT1AReZut,"australian alternative rock, australian dance, collage pop, electronica, indietronica, new rave, psychedelic hip hop"
In Limbo,0xivCtzVVrdeq32s8EnOO6,"alternative rock, art rock, melancholia, oxford indie, permanent wave, rock"
"My Rifle, My Pony And Me - Remastered",73VWTEHnoZyULD840kEX49,"adult standards, doo-wop, rock-and-roll, rockabilly"
Get Your Walk On,1RPhSs2lDYKjDsELKtPvQd,"detroit hip hop, g funk, gangster rap, hardcore hip hop, hip hop, west coast rap"
Por Muchas Razones Te Quiero,3uNHsihawfIiZv8XClEZoY,"cancion melodica, mexican rock-and-roll, pop romantico, ranchera"
Rainbow Stew,0FBfvGkoyDsn1cjtJJzTWK,"bakersfield sound, country, country rock, nashville sound, outlaw country"
I Like It,58q2HKrzhC3ozto2nDdN4z,"pop, rap"
Lo Unico Que Quiero,0L5Qug0k2UpMBF3vKtHUGq,"latin christian, latin worship"
True - Single Edit,0CsM8VGDi38kusMv3pxyj1,"new romantic, new wave, new wave pop, sophisti-pop, synthpop"
"So Fresh, So Clean - Radio Mix",3GXAAgzvRuEiyiPGGUD1e1,"atl hip hop, dirty south rap, hip hop, old school atlanta hip hop, rap, southern hip hop"
Your Fuckin’ Head Split,1WkJbf3RsZCtPUvxM8AdN9,horrorcore
Feelin' On Yo Booty,7cFQFr1VpkSp3BTIn7X719,
Monton de Cartas,0qswdz27z5Zy03v7ic8HHW,norteno-sax
Get Back - Remastered 2015,6zmQ8bzlDIfngjy0Ba3w46,"beatlesque, british invasion, classic rock, merseybeat, psychedelic rock, rock"
Dorham's Epitaph - Remastered 2014,28UC4Sk3EHAuEbTSQxoGsP,"bebop, hard bop, jazz, jazz trumpet"
Boiler,1a3RarhRdrNSTEEERYEFJn,"alternative metal, funk metal, nu metal, post-grunge, rap metal, rock"
"24 Preludes, Op. 11: No. 15 in D-Flat Major",7q3GsLvBEzkef7Nm8gNwxP,"classical, contemporary classical, early modern classical, impressionism, late romantic era, russian romanticism"
Everything Means Nothing To Me,6YNfrgCOy1dCXZKKRUuZVq,"alternative rock, indie rock, melancholia, singer-songwriter"
Help! - Remastered 2015,3Smida2eCUsLzDcmZqXEZ3,"beatlesque, british invasion, classic rock, merseybeat, psychedelic rock, rock"
King of Sorrow,0qQcQIj6htaCX7KFrsciNU,"british soul, sophisti-pop"
Don't Mess With My Man,39YovPslPCXbFYhlYjsZ2Y,"atl hip hop, contemporary r&b, hip pop, r&b, urban contemporary"
Most Girls,10GJQkjRJcZhGTLagFOC62,pop
One,1zi7xx7UVEFkmKfv06H8x0,"canadian hip hop, canadian pop, hip hop, pop rap, rap"
Spanish Ladies,3XDGPQQGrW8sPstEqket1J,shanty
