Song Name,Song ID,Genres
(Sittin' On) the Dock of the Bay,3zBhihYUHBmGd2bcQIobrF,"classic soul, memphis soul, soul, soul blues, southern soul, vocal jazz"
Duffle Bag Boy,5l53XkYN5rTYmdJ0P2GKFT,"atl hip hop, dirty south rap"
Higher Love - Single Version,17Ng10tIgnYmAitl0SgT3R,"album rock, classic rock, folk rock, heartland rock, mellow gold, singer-songwriter, soft rock"
Never Would Have Made It,3QdBvvYJ9k1CES1e9aYvaA,gospel
Realize,5OGkKx8jP0A5KSULEc6XYZ,"dance pop, neo mellow, pop"
When You're Gone,0U1W2LZVUX7qTm7dDpqxh6,"canadian pop, pop, viral pop"
A Quién Vas a Amar Más Que a Mí,1IV8PlSxx5PUiaxKwVrlg9,"mariachi, ranchera"
The Pride,4HQAeEIplslteReNxE8jFW,"alternative metal, groove metal, nu metal"
I Get Money,1FKFCvi0i46qEJLZSEBH8p,"east coast hip hop, gangster rap, hip hop, pop rap, queens hip hop, rap"
Corazón Mágico,6RRtNiWSCiqMUTkKjTdZOf,"banda, musica mexicana, norteno, sad sierreno"
Rock Star,6KN9atd3DRhmSRWeCSKkkL,"pop, post-teen pop"
Fabulous,6jyXQ8HGI7ikECGA0670uo,"movie tunes, west end"
Gunslinger,7MOQrtXMNImAq5TrPZzC0w,"alternative metal, nu metal"
Harder Than You Think,5YpZh8wfS4moRBk0ijNcXr,"conscious hip hop, east coast hip hop, golden age hip hop, hardcore hip hop, hip hop, old school hip hop, political hip hop"
Falsetto,2P1e3xpjDhYFqOFeu8IWzS,"dirty south rap, hip pop, r&b, southern hip hop, trap, urban contemporary"
Dear God,79DZ36cgwkw38bszTWltiW,"canadian hip hop, ottawa rap"
Underclass Hero,6dXizHF3KbmdvOgvMAhnQC,"alternative metal, canadian pop punk, canadian punk, modern rock, nu metal, pop punk, post-grunge, punk, rock"
D Is for Dangerous,45QyGXbqTWaFUrIKe2ugs3,"garage rock, modern rock, permanent wave, rock, sheffield indie"
Whatever It Takes,6Qn5zhYkTa37e91HC1D7lb,"modern rock, pop, rock"
Corazón Mágico,6RRtNiWSCiqMUTkKjTdZOf,"banda, musica mexicana, norteno, sad sierreno"
That Home,4jSuthawb7fitf3Wx3MqVM,"downtempo, nu jazz"
Tren Al Sur,6W1BLmVBxkqZwFQcORQLnv,"chilean hardcore, chilean rock, latin rock, rock en espanol, ska chileno"
"Rêverie, L. 68",086sjLPEqdKBgTxbTeCLCv,"classical, impressionism, post-romantic era"
The Bleeding,0PhgdhsVVVFQBAL4FXSy1K,"alternative metal, groove metal, nu metal"
I Don't Dance,5aj0xPGiEUN3aI2oOYu14S,"contemporary country, country, country road, modern country rock"
Awaken,4oYzwOTWpP3JTyKrTHJtqw,vapor soul
I'm Like A Lawyer With The Way I'm Always Trying To Get You Off (Me & You),6A9nyMBdNUzVcFHZUEZ71F,"emo, modern rock, pop, pop punk, rock"
Goodnight and Goodbye,5Ha1C6wXnYGUCWhsfnPM0w,"boy band, pop"
It's 5 O'Clock Somewhere - Live,4eD5JlitG73IjAgce51tYE,country
Hard Sun,0fzCtVM9D5UEwiLqcY8Ouq,"acoustic rock, grunge, permanent wave"
Famous,19a3JfW8BQwqHWUMbcqSx8,"chicago rap, hip hop, rap"
Chemical Kids and Mechanical Brides,2k3fs1S5gYqwzN8G2QDXiJ,"pop punk, screamo"
Society,3bHhUEOTIbezeZ856R0BX5,"acoustic rock, grunge, permanent wave"
Pajarillo,2ZCG2fdMvFM2yv2MwhUJKL,"musica mexicana, musica neoleonesa, norteno"
Falling Slowly,7f4bsFFcKOU7ysIPjj0yCj,singer-songwriter pop
Por Amarte Así,2bvO1KXbUd4vySCWGNqIIa,"latin arena pop, latin pop"
Juicy,5ByAIlEEnxYdvpnezg7HTX,"east coast hip hop, gangster rap, hardcore hip hop, hip hop, rap"
Fake Empire,7hanhZrUArC9qUerln4jh1,"chamber pop, indie folk, indie rock, indietronica, modern rock"
East To West,1wV6lCsV2PCeVZlyGTkVPt,"ccm, christian alternative rock, christian music"
Nobody's Perfect,6Nw1WHydftZy2joT2nTiCR,"conscious hip hop, hip hop, north carolina hip hop, rap"
Same Girl (with Usher),6OSmeoh8kXhCfz9WqvzDoJ,
Eyes on Fire - Zeds Dead Remix,3Oiauiojgokw9vWQvFmEoI,dream pop
Tick Tick Boom,6tedQ1ZmbygqhbdcfJL7Xb,"alternative rock, garage rock, garage rock revival, modern rock, rock, swedish garage rock, swedish hard rock, swedish indie rock"
Wake Up Call,1zqllQUMCgMaInr0CzFVll,pop
Like This (feat. Eve),3sfydNh0QQAdnIAtDVG16H,"atl hip hop, dance pop, hip pop, r&b, urban contemporary"
teachme,0ODFPypnJLE6hKgahiuSzn,"contemporary r&b, neo soul, r&b, urban contemporary"
Scream,2iJuuzV8P9Yz0VSurttIV5,"dance pop, pop"
Te Lloré,6uYtv0KmSNBGFfaY7yW8tY,"latin arena pop, latin pop, latin rock, mexican pop, mexican rock, rock en espanol"
Miserable At Best,1ONoPkp5XIuw3tZ1GzrNKZ,"neon pop punk, pop emo, pop punk"
Sleeping Lessons,3Bz3lj6E9VFBk1Wj1hC8vw,"albuquerque indie, alternative rock, canadian indie, chamber pop, indie pop, indie rock, modern rock, portland indie, seattle indie, shimmer pop, stomp and holler"
Hum Hallelujah,028njLMKzGg4gAVSgMeOhm,"emo, modern rock, pop, pop punk, rock"
Don't You Evah,3UytFqZuZwJFsTPti5gcPB,"alternative rock, austindie, indie rock, modern rock"
Balaclava,11DdPGqDsM3ux1gVAqUIln,"garage rock, modern rock, permanent wave, rock, sheffield indie"
Flaws and All,30Z84zKyyx3Hn2Af8OdwaR,"pop, r&b"
Come Around,2zkhW5YaOPPaPgNWXmjTjF,indie pop rap
Kill the Director,6uhvuMDb93ANzVxNABDgf1,"liverpool indie, modern alternative rock, modern rock"
Still In Love With You,6vTAp3ol52KNzJNzm96GMO,"boy band, pop"
I've Changed (feat. Keyshia Cole),49cSN8JC12jp5F5A7yauTf,"contemporary r&b, new jack swing, r&b, urban contemporary"
Love Me Dead,3IlYkyctlcTqXAZOA4ZPzz,tulsa indie
El Último Beso,5sQiPI9krkeb9aAvl7tDyn,"mariachi, ranchera"
Zun Da Da,6DxS2ZRl8G3EagHkovYXA2,"reggaeton, urbano latino"
Pop Bottles - Main,1kEp3Po9RUPm11N5ITOUWx,"dirty south rap, southern hip hop"
Hey Baby,3rfhI32Il2hVRKDkuGeeen,"dance pop, miami hip hop, pop"
Es Tan Difícil,0Ihu6hcj4hrWVz22W3G10P,"bachata, bachata dominicana"
Bang The Doldrums,1Fvf8AO4GWwjLU12Im0s0q,"emo, modern rock, pop, pop punk, rock"
the WORLD,62KZRwymXq9Rgm8Cm5UCfx,"adult standards, easy listening, lounge"
"Vuela, Vuela (Voyage, Voyage)",59DBFv5MOW0M4KSF78rHw7,"latin arena pop, latin pop, mexican pop"
Inalcanzable,3VlS9yWZ9WkzaePi8oobTj,latin pop
Crying Out For Me,3lMgczyYCjVDpJX8Wl2ilu,"dance pop, hip pop, r&b, southern hip hop, urban contemporary"
"Sugar, Sugar",6MTd61g9zq6CB1FnJydjEb,"bubblegum pop, classic canadian rock, rock-and-roll"
Whine Up (feat. Elephant Man) - English Version,6Avndj1UPQLwR2qqzDwZBc,"dance pop, post-teen pop"
Stille Musik: 3. Augenblicke der Serenade,308fmwi0Y8ULBSzthdhooI,"ukrainian classical, ukrainian classical piano, ukrainian contemporary classical"
Whiskey Lullaby,4BXkf6yww23Vdju7E1fUrn,"contemporary country, country, country road"
I Am Your Gummy Bear (The Gummy Bear Song),6nFYXpBgrNcZjbtNEuc6yR,cartoon
A Different World,0E0B8a7LSVgbQL160oUnwO,"country, country road"
Golden Skans,6BqWhxll86CGGE6WxgdRqG,"alternative dance, dance-punk, indie rock, modern rock, neo-synthpop, new rave"
Jersey,2Z2MAil7tpZhHOB2noIJUd,
Empty Walls,6Y2kW1mdHE0znPCjtOdt5m,"alternative metal, nu metal"
Into Yesterday,02TQFXm2cV6uwOr2OmlYBC,"alternative metal, funk metal, pop rock, post-grunge"
Thrash Unreal,3c3XnCPwxGhQEHFxxjQcWe,"folk punk, gainesville indie, orgcore, punk, skate punk"
Washed by the Water,3rXoaocGAOEq6CorwCiI4J,"ccm, christian alternative rock, christian indie, christian music, folk-pop"
The Anthem,0BRHnOFm6sjxN1i9LJrUDu,"alternative metal, modern rock, neon pop punk, pop punk, pop rock, post-grunge"
De Ti Exclusivo,404MXA5pRTh93BrxPeGrQp,"banda, musica mexicana, norteno"
All My Friends,6TaqooOXAEcijL6G1AWS2K,"electropop, uk dance"
You Are the Music in Me,6TRp2628QKH3kY6KrCnjqp,movie tunes
Torn,1Jaah2tmN9Hv81A87KZ1MU,"dance pop, europop, lilith, new wave pop, pop rock"
Stronger,0j2T0R9dR9qdJYsB7ciXhf,"chicago rap, hip hop, rap"
With Me,1OTvWduKQV0MQd2gnGM9He,"alternative metal, canadian pop punk, canadian punk, modern rock, nu metal, pop punk, post-grunge, punk, rock"
Rest My Chemistry,2O5UcpKolgLT8l8yAvEmID,"alternative dance, alternative rock, indie rock, indietronica, modern rock, rock"
Evolution,3RAysZh9cCJglYGY5Dd1Lf,
Cada Que...,1IDfAcL63xIRjG4Q98yTfn,"latin arena pop, latin pop, mexican pop"
Videotape,4T1iiabe7G0UjWQJCY6NE2,"alternative rock, art rock, melancholia, oxford indie, permanent wave, rock"
Perfume a Tus Pies,5cS1TaKqN5z5brcTnG2Ory,"latin christian, latin worship, rock cristiano, world worship"
Making Memories Of Us,0Sg5kWoILCs2zBoIHIsDAa,"australian country, australian pop, contemporary country, country, country road, modern country rock"
Hoy Ya Me Voy,58zE9NyMKGTpzV5J8WyXXe,"latin pop, puerto rican pop"
Your Rocky Spine,3CecLFOWdbQwc2qdTmHAc8,"canadian indie, canadian indie folk, canadian singer-songwriter, chamber pop, indie folk, ontario indie, stomp and holler, toronto indie"
They Know (Dey Know),6TQANhh0iV17xMeExcH6qj,"atl hip hop, dirty south rap, old school atlanta hip hop"
Shoulda Let You Go,1yTfczdv9qGCfJpZF3y4yQ,"hip pop, r&b, urban contemporary"
New Shoes,265Anh9hGoozFigjUVLUeD,"british soul, neo mellow, scottish singer-songwriter"
Slip Slidin' Away,0zb2kpEQMnqJPiLACKMiFM,"classic rock, folk, folk rock, mellow gold, permanent wave, rock, singer-songwriter, soft rock"
Dos Hojas Sin Rumbo,2EjxmOw1V5MZ40S7rCiHeP,"banda, musica mexicana, norteno"
Go On Girl,3QE7ObGjkt1kYnhLvZPRUy,"dance pop, pop, r&b, urban contemporary"
Faust Arp,15irEKZ9D6FQqLoZ1qJ1Cx,"alternative rock, art rock, melancholia, oxford indie, permanent wave, rock"
"Working My Way Back to You / Forgive Me, Girl",1wouF9mtyiwZDYiq5YElaq,"classic soul, disco, funk, motown, philly soul, quiet storm, soul, southern soul"
Another Believer,26zlrWTl45duRsgdxBin1T,"canadian pop, chamber pop, melancholia, piano rock, singer-songwriter"
El Matador,7N2qyJrAp16ghZFBloT8Ye,"argentine rock, latin alternative, latin rock, rock en espanol, ska, ska argentino"
I Wonder,7rbECVPkY5UODxoOUVKZnA,"chicago rap, hip hop, rap"
I Need You,1n2N1qOSZcjGmaIoJSjgZa,"country rap, nashville hip hop, tennessee hip hop"
Do You,2yi7HZrBOC4bMUSTcs4VK6,movie tunes
Lost in This Moment,6WacAQkSA7QkEPnxse7WWw,"contemporary country, country, country road"
Church (feat. Teddy Verseti),7cyBdix7HId2onf99SrJBV,"dance pop, gangster rap, hip hop, pop rap, r&b, rap, southern hip hop, trap, urban contemporary"
"Too Much, Too Young, Too Fast",2LQbBzrXkgQHnCDUmHjReH,hard rock
Straight To The Bank,6530klKZZmOHL2ACme2rRJ,"east coast hip hop, gangster rap, hip hop, pop rap, queens hip hop, rap"
Dímelo,7padZo2BuCEZpxOXOjugb7,"grupera, musica mexicana, ranchera"
Nighttiming,1jbrKpiTZ5jSblBypybUmV,"indie rock, indietronica, la indie"
Kiss Me,754kgU5rWscRTfvlsuEwFp,"lilith, pop rock"
Tell Him,7iCs98iS5n6KCI4q3H7zp9,"alternative r&b, conscious hip hop, hip hop, neo soul, new jersey rap, r&b, soul"
Break the Ice,52K4Nl7eVNqUpUeJeWJlwT,"dance pop, pop"
Never Enough,0Gl5s8IhMmQE5YQwM8Qx1J,"deep talent show, hollywood, movie tunes"
Saferwaters,6e9s42iBN7bt5QvCvFlVUs,"alternative metal, christian rock, nu metal, post-grunge"
When It Rains,1mMLMZYXkMueg65jRRWG1l,"contemporary country, country"
All over You,0sqE6XPi9VAaWl5NxDyMQK,"grunge, pop rock, post-grunge"
Bounce,0SGkqnVQo9KPytSri1H6cF,"detroit hip hop, hip hop, pop rap, r&b, rap, trap"
Broken,2fXwCWkh6YG5zU1IyvQrbs,"pop, r&b, rap"
You Can Do It,4NTn0Yo8hTGW5tbBANBzfh,"conscious hip hop, g funk, gangster rap, hip hop, rap, west coast rap"
Last Request,6xM8oBy40nK1rOd8WmoOPx,"british soul, neo mellow, scottish singer-songwriter"
Gotas De Agua Dulce,0Xn1VqBjoL4PAGxyatEO0Z,"colombian pop, latin pop, mexican pop, rock en espanol"
Like You'll Never See Me Again,3JHDtmFdX9kdx9wz0md98U,"neo soul, pop, r&b"
Kill All Your Friends,65wICNTM2s1PwXSgKt8f0a,"emo, modern rock, pop punk, pov: indie, rock"
The Anthem,0BRHnOFm6sjxN1i9LJrUDu,"alternative metal, modern rock, neon pop punk, pop punk, pop rock, post-grunge"
Cinderella,5MWXOo8DJwgODtPGaietNz,alt z
Keep the Car Running,4KjdLo9JWJEKYoAJ8spkat,"alternative rock, baroque pop, canadian indie, chamber pop, indie rock, indietronica, modern rock, permanent wave, quebec indie, rock"
Music For Love,5gikplVdSoYfG0YKCRuicp,"dance pop, hip pop, r&b, southern hip hop, urban contemporary"
Where You Lead I Will Follow,5htNlXFlMI6RMBHhJuGJJm,"brill building pop, classic rock, folk, folk rock, mellow gold, singer-songwriter, soft rock"
Go Girl,1MgM0WDaoQ2A3bnIQTR6ty,"dance pop, miami hip hop, pop"
I'm Not Jesus - International Version,7rCHmESfvRcjqaU7My7ge8,"cello, finnish metal"
"What's up, people?!",07qCt941ZIm3alfGCoP247,"j-metal, japanese metalcore"
Tu Pendejo,5qSOoG9Wgmzrp5OE8Uxhn1,"musica mexicana, norteno"
Get Buck In Here,5zN3VFmNhdOKxRElarvVq5,pop rap
Impossible Germany,6L0BBPYeWnaQJeDa0ox0IA,"alternative country, alternative rock, chicago indie, indie rock, roots rock, stomp and holler"
Ya No Te Amo,7H4tgQ4ldZ1PmWL88b6nuI,"banda, musica mexicana, norteno"
Turn Up The Radio,547JIm8YGOKDzBp2JsX4a4,"album rock, glam metal, hard rock"
A Bay Bay - Single Version,2oWbOh3tLluqTdYL5OEDvs,dirty south rap
Macario Leyva,2kXc2dAdkCpnlRXTtvEe67,"banda, musica mexicana, norteno"
Let the Flames Begin,7fx2rt43UfclOOulPwBYk2,"candy pop, modern rock, pixie, pop, pop emo, pop punk, rock"
Everyday,2N3U8uTYhjX2KwGT0pf5x0,"east coast hip hop, hip hop, rap, trap"
Respect - 2003 Remaster,5AoTuHE5P5bvC7BBppYnja,"classic soul, jazz blues, memphis soul, neo soul, soul, southern soul, vocal jazz"
Phantom Limb,3NPiFBw3mA9qbJfo0nhk6X,"albuquerque indie, alternative rock, canadian indie, chamber pop, indie pop, indie rock, modern rock, portland indie, seattle indie, shimmer pop, stomp and holler"
Everything's Magic,3I7IGPFe0DoNXZI9JDYa5P,"pop punk, socal pop punk"
Ponganme Canciones Tristes,5szpV99HOA7W1rv3KU1TtF,"cumbia sonorense, musica sonorense, tecnobanda, tejano"
Into the Night,0rhyBUAgNXwdyvGVXSrLzc,
California Dreamin' - 2007 Digital Remaster,4MHzXgBy7hexDe2Bto11hP,"baroque pop, classic rock, folk rock, mellow gold, psychedelic rock, rock, sunshine pop"
Somebody Like You,0b9djfiuDIMw1zKH6gV74g,"australian country, australian pop, contemporary country, country, country road, modern country rock"
Sin Tu Amor (feat. Alex Pro),63hZCrRfcZza3npjwt3Ezs,"panamanian pop, reggaeton"
The Way I Am,23wfXwnsPZYe5A1xXRHb3J,"detroit hip hop, hip hop, rap"
Por Ti,7M7459QUMDR8c8tm124d9l,"banda, duranguense, musica mexicana, norteno"
Tum Se Hi,7eQl3Yqv35ioqUfveKHitE,"filmi, indian instrumental, modern bollywood"
Imagine,7pKfPomDEeI4TPT6EOYjn9,"beatlesque, classic rock, rock"
Luna,3RA55zrRkyPK8Fd86hrMy8,"corridos tumbados, sad sierreno"
Pretty Rave Girl,3G1SVODcssMmS5YM5G3tun,"australian dance, freeform hardcore, happy hardcore"
Counting Stars,2tpWsVSb9UEmDRxAl1zhX1,"piano rock, pop"
Donk,7n2Dqgp4iXd8Zorfj9XSYo,"atl hip hop, chicago bop, dance pop, pop rap, rap, southern hip hop, trap"
Have You Ever,2LawezPeJhN4AWuSB0GtAU,"classic rock, country rock, rock, southern rock, swamp rock"
The Weekend - Radio Edit,6KzkqZqhUBEsWYJJa2aBOd,"disco house, vocal house"
Midnight Hour,1Nl0nKMX15Q3c1CS5E3DSM,"austin americana, folk-pop, new americana, roots rock, stomp and holler"
War Pigs,2rd9ETlulTbz6BYZcdvIE1,"album rock, alternative metal, birmingham metal, classic rock, hard rock, metal, rock, stoner rock, uk doom metal"
Oklahoma Breakdown,0J4yorvZG8iF6zlaf1zRhK,"classic oklahoma country, classic texas country, heartland rock, outlaw country, red dirt"
Lean Like A Cholo,5EQjO4dIVCU6FUKrmkJ13M,
If You're Reading This,3opmoDn4nG2eZWPjI8B7Bg,"contemporary country, country, country road"
None Shall Pass,207jvv3SLF6CGhVW2gOanq,"abstract hip hop, alternative hip hop, conscious hip hop"
Hello Song,2vAqkAPeZsp8qJUDysmkmi,kindie rock
The Plot To Bomb The Panhandle,3u9L3hmDGB9pWSAA2y24XT,"alternative metal, metalcore, neon pop punk, pop emo, pop punk, screamo"
Just a Dream,3ZdJffjzJWFimSQyxgGIxN,"dance pop, gangster rap, hip hop, pop rap, rap, st louis rap, urban contemporary"
Let's Dance to Joy Division,60Ih7J2Q1o9shvMC2OAALu,"liverpool indie, modern alternative rock, modern rock"
All The Same,5xy2cj5d2WOTjPkkHuVH84,background piano
Silver Lining,0i5QVxsK3IvEDbUjTA64Li,"pov: indie, stomp and holler"
L O V E,4QxDOjgpYtQDxxbWPuEJOy,"adult standards, lounge, soul, swing, vocal jazz"
Just Friends,27eb4YUlqGJdnleIlg8cA3,bedroom r&b
"Suite Bergamasque, L. 75: III. Clair de lune (Andante très expressif)",6N7JzrteJv8lsr1GWYyu0b,"classical, impressionism, post-romantic era"
You Should've Killed Me When You Had The Chance,5Tm77XWabel3dQXFSrIgWe,"alternative metal, metalcore, neon pop punk, pop emo, pop punk, screamo"
Alcohaulin' Ass,1OXzwmEPLq7cR6J6sbcLto,"alternative metal, groove metal, industrial metal, nu metal, post-grunge, southern metal"
Like Whoa,44e84JcEUfOs9cNGu8nwU5,"dance pop, girl group, post-teen pop"
Across the Line,4dbveKUpOx62SiwXQCALQH,"alternative metal, nu metal, post-grunge, rap metal, rock"
Monsoon - Gateway Version,1QDvX3Oa7xM0So8P7qYqVN,german pop rock
This Magic Moment,4vBDAxKllafwCMDWD76atv,"adult standards, doo-wop, rock-and-roll, rockabilly, soul"
This House Is a Circus,7gPd55hW5pVjTm3H9S1Wbv,"garage rock, modern rock, permanent wave, rock, sheffield indie"
Can't Be Saved,3R0S1d6GJ6hW2L9M43S9Kb,"emo, neon pop punk, pop punk, post-hardcore, screamo"
Australia,47TQjzeG4KI0XWWb0wkbri,"albuquerque indie, alternative rock, canadian indie, chamber pop, indie pop, indie rock, modern rock, portland indie, seattle indie, shimmer pop, stomp and holler"
Is There A Ghost,7fgOmdonXZap1Kuz7hs3O1,"chamber pop, indie folk, indie rock, indietronica, modern rock, stomp and holler"
Como La Brisa,5GjG4bnnc8uLqH0VvP1Fby,"latin christian, rock cristiano"
There You'll Be - 2007 Remaster,1s2khOWzC99udpUaPICLJI,"contemporary country, country, country dawn, country road"
"Down To The River To Pray - From “O Brother, Where Art Thou” Soundtrack",3WJ8xIHrNTtP5YsXOqqyml,"bluegrass, folk, progressive bluegrass"
The Difference Between Medicine And Poison Is In The Dose,3SizB9Beb0HZHww3PjoXbQ,"dreamo, emo, philly indie, post-hardcore, progressive post-hardcore, screamo"
Firecracker,5JtRN8PCpxoL03vnIpZXc7,"contemporary country, country, country road"
Well Enough Alone,2mMb3id4Cg7iTwz92wPrTu,"alternative metal, christian rock, nu metal, post-grunge"
I'm Me,2ePiBvKtQOCBHq9uOlwiiU,modern country pop
White Girl,5yJzkdwbrQCwua2dIC3K6A,"drill, memphis hip hop, trap"
Bleeding Love,7wZUrN8oemZfsEd1CGkbXE,"british soul, dance pop, pop, talent show"
Ni**a Ni**a Ni**a,2oBd6KgXMeh0alqHHli0J4,meme rap
My Body Is a Cage,1rOlTL4pKQ9Y1fURua4AJR,"alternative rock, baroque pop, canadian indie, chamber pop, indie rock, indietronica, modern rock, permanent wave, quebec indie, rock"
In The Rain,0fR8y0bMqFn0mDdZoksk7N,"chillwave, edm, indietronica"
Precioso Jesús,7mEYivIHySFGJS8HySzcf2,"latin christian, latin worship"
Arizona,3Hq3RKDkxVUJAqXegdf5Bq,"modern rock, rock"
Cupid's Chokehold / Breakfast in America - Radio Mix,6ajyEEzWZbw8ycDcJAN099,"dance pop, pop rap"
On the Hotline,1zyqZONW985Cs4osz9wlsu,"dirty south rap, hip pop, miami hip hop, r&b, southern hip hop, trap, urban contemporary"
I'd Rather Die Than Be Famous,5M08Cm5ZIlgFoFMYd3zlz6,"pop punk, screamo"
The Bad Thing,48ucaKjccruxDbi3Au5ZaH,"garage rock, modern rock, permanent wave, rock, sheffield indie"
Say This Sooner,7waZfrpjfOYktwulz6fo02,"christian alternative rock, neon pop punk, screamo"
Nothing Left,3WhglCUuc5HGhvtzfjc8YY,"country rap, nashville hip hop, tennessee hip hop"
Hallelujah,3pRaLNL3b8x5uBOcsgvdqM,"melancholia, permanent wave, singer-songwriter"
Amantes Escondidos,4PbrxFKJg5rLkZ77vKhhY9,"banda, musica mexicana, norteno"
When Did Your Heart Go Missing?,60okmgzrYnFh2nXfi0XxWR,modern power pop
Father (Soul),5SkHS4OmeMVUiPwRdQpth0,"bboy, instrumental soul, trip hop"
"Paris, Tokyo",2dXME00xUY1CRcMZsM3Y4q,"chicago rap, conscious hip hop, hip hop, political hip hop, pop rap, rap, southern hip hop"
Someone Great,2VGDntFPvgvqSiUf9ITEfW,"alternative dance, alternative rock, art pop, dance rock, dance-punk, electronic rock, electronica, indie rock, indietronica, neo-synthpop, new rave"
Feet Don't Touch the Ground,5jlKg466AQEoBSPJ8y8wyY,"classic oklahoma country, classic texas country, heartland rock, outlaw country, red dirt"
You Can't Stop The Beat,7goE6wDBvkZoeWrFm0EdCg,"hollywood, show tunes"
And I Told Them I Invented Times New Roman,7CR0CfMEC6BZBuYLaKSbu9,"pixie, pop punk, sacramento indie, screamo, swancore"
Take My Breath Away,15MJ5NThPjj6xhPcts8MiY,"new romantic, new wave pop, synthpop"
Come Around,2zkhW5YaOPPaPgNWXmjTjF,indie pop rap
Inténtalo Tú,2UFQi6Zr1yeaaUaUmbw4ZI,"bachata, bachata dominicana"
The State Of Massachusetts,0kXpvPNNjjPsEGRg3SE0xW,"boston punk, boston rock, celtic punk, celtic rock, punk"
Te felicito,2rurDawMfoKP4uHyb2kJBt,"colombian pop, dance pop, latin pop, pop"
First Time,4LesrBswFnLcHmwDslst1q,"irish singer-songwriter, modern rock, pov: indie"
Anthem For The Underdog,6FFwt1ea9hJ4MfMQLywahm,"alternative metal, christian hard rock, nu metal, post-grunge"
When I Get Home You're So Dead,6QitaJF6Vj2O8sxf8VxsRI,"neon pop punk, pop emo, pop punk"
"If You Were There, Beware",0ZUXj43fteJjwvGoLMntte,"garage rock, modern rock, permanent wave, rock, sheffield indie"
Shorty,55ZATsjPlTeSTNJOuW90pW,"latin hip hop, mexican hip hop"
I'll Still Kill,0XV3lm3ZxKUr6FiWVdJuyk,"east coast hip hop, gangster rap, hip hop, pop rap, queens hip hop, rap"
Take Me Away,0jSfQJjEPrcVHr6f7x3D8X,post-grunge
Genesis,3cjvqsvvU80g7WJPMVh8iq,"art pop, canadian electropop, grave wave, indietronica, metropopolis, neo-synthpop"
Lowlife (Living the Highlife),50kcRtu673zyBLtvvRMKHg,nu metal
Snake Eater,2e3g8go386Zn6EyIz60Ci9,
The Wonder of You,0LfJkvPNCNEMLpZJgDQiV1,"rock-and-roll, rockabilly"
"Sweetest Girl (Dollar Bill) (feat. Akon, Lil' Wayne & Niia)",4liGjmhCupa7RP9JaQELYx,rap kreyol
I Love You,0NaUT74rJ0NHS62fewzatU,"sigilkore, sped up"
FMLYHM,7kwsODkk97z4tn9pW3GkaK,"alternative metal, nu metal, post-grunge, south african rock"
Ruby,4hupcimlg3UBbW1kAQ6vrT,"album rock, british invasion, classic rock, rock"
Hip-Hop Saved My Life (feat. Nikki Jean),6N3oYlfZ2RPdjMYdHCRmFS,"chicago rap, conscious hip hop, hip hop, political hip hop, pop rap, rap, southern hip hop"
Cuando el Sol Salga Al Revés,421JL88eYQqTCwEmsNmmXj,"banda, musica mexicana, musica sonorense, norteno"
Whistle For The Choir,3jp7Ryj1sX3riA7NQaVlLd,"garage rock, modern rock, scottish rock"
Nothin' But The Cavi Hit,2rwmKpWW6o6anOhvcyiJOw,"g funk, gangster rap, west coast rap"
Inseparable,57GWBz1UtT6iei1jrbkovI,sad sierreno
Praise Him In Advance,3fJ1I1XNSSs7BcLkOxSCUp,gospel
Hello Beautiful,7bhoPvDq4gDQ58JkqP9uAG,"boy band, pop"
México Lindo y Bandido,7JxTp4HrI99hr6L3VMCZbj,"latin hip hop, mexican hip hop"
Nobody's Baby,3oEKGKQUJch8ZXSApOvEmi,"black americana, funk, retro soul, soul"
Listen to the Music - Single Version; 2006 Remaster,4feNlb6HlpBrW36SsXoUfh,"album rock, classic rock, country rock, folk rock, heartland rock, mellow gold, rock, singer-songwriter, soft rock, yacht rock"
Hollywood,7sWRlDoTDX8geTR8zzr2vt,"dfw rap, melodic rap, pop, rap"
No Me Soltarás,48lwAoNI4cQZ9YOizzTPL8,"latin christian, latin worship, rock cristiano"
Empezar Desde Cero,1tJ7QglWwgMg3XDG82ZMsF,latin pop
All I Want Is You,5VA4Ispp52EA1sOqzMz3Av,"r&b, urban contemporary"
Thunder,1zB4vmk8tFRmM9UULNzbLB,"modern rock, pop, rock"
Green Light,6ie2Bw3xLj2JcGowOlcMhb,"art pop, metropopolis, nz pop, pop"
Que Me Des Tu Cariño,4YRluWE35IfHucz5HJjCOe,"bachata, latin pop, tropical"
Fall,0rCFRyEy4WXjRXNpO80Dzs,"contemporary country, modern country pop"
Mira Quien Vuelve al 100,1qzXMky2Axu0GZ6gInAof9,"latin hip hop, mexican hip hop"
"Vuela, Vuela (Voyage, Voyage)",59DBFv5MOW0M4KSF78rHw7,"latin arena pop, latin pop, mexican pop"
Love Season,2GpKIU4njRoMFndGdVPwfd,kaneka
Waymore's Blues,0lWHgpQIg3NcVLHnEP1h4b,"classic texas country, country, country rock, outlaw country"
Changes,7AFASza1mXqntmGtbxXprO,"emo rap, miami hip hop"
I Feel It All,3ghgwo0BTPm329zGMQRfn7,"art pop, canadian indie, canadian pop, chamber pop, indie pop, indie rock"
Mississippi,4vO9dmzNRqDhFY3jD1a3P7,"album rock, blues rock, classic rock, country rock, electric blues, hard rock, proto-metal, psychedelic rock"
Games,0kFvkwicbdsC2ML55qmV8V,indie soul
Drella,2tr3bmoQBQrLHUYxsg8LpF,"pop punk, screamo"
Aguanile,0Bf3bLtRSlpXl5l5MuzZd6,"latin pop, modern salsa, salsa, tropical"
Ces petits riens,1f5RkzhoRnzCO6AzMhkhdY,"contemporary vocal jazz, vocal jazz"
This Kiss,5EYWGM3Ns3iYew8ws0FatB,"contemporary country, country, country dawn, country road"
Gracias por tu amor,5J2vj11vmsgj3EefxvLnvW,"banda, musica mexicana, norteno"
Mi Buen Amante,1aRrxkV7U4uDhrVkJt8F6Y,"banda, musica mexicana, musica sonorense, norteno"
On Call,28POcTYQKfkjz6qTIvtjG1,"modern rock, rock"
Famous In a Small Town,4oXOOBwZsHFnRRNBNXrr9X,"contemporary country, country, country dawn, country road"
A Little Less Conversation,3j4viUIDSuB4xfYYlp3Lpa,"rock-and-roll, rockabilly"
Crank That (Soulja Boy) [Travis Barker Remix],5WeiB5JDBy6T5QQxtj09zb,"atl hip hop, chicago bop, dance pop, pop rap, rap, southern hip hop, trap"
Big S**t Poppin' [Do It],5tEbnKMOMK8LLoOIsEkWRr,"atl hip hop, dirty south rap, gangster rap, hip hop, pop rap, rap, southern hip hop, trap"
The Balcony Scene,4CI0vy8nofOwD62JR7sjbV,"pop punk, screamo"
Sensual Seduction,1wva1IlWLDNLgwipUWcmjy,"g funk, gangster rap, hip hop, pop rap, rap, west coast rap"
Skyway Avenue,3RQFICPJMsBazO66qK808s,"neon pop punk, piano rock, pop punk"
Arrival to Earth,4u4VElxO7JM4IR4jR4TL1s,"epicore, soundtrack"
Let It Die,12JNRHoQ8UlmdkhXxY1UcB,"indietronica, metropopolis, pop, uk pop"
Wind Blow,2SO6T1KaYLu4yXP4qf286F,"gangster rap, hardcore hip hop, hip hop, ohio hip hop, rap"
Ratatouille Main Theme,3TKBtgtJSnH7XZN2Z628vT,piano cover
No Te Veo - Remix,72tAU6b10AgYfEFKrykp8J,reggaeton
Riders On The Storm - Fredwreck Remix,0RcYEWXtbu4ehdv1tiBOi0,"g funk, gangster rap, hip hop, pop rap, rap, west coast rap"
Cuando Vayas Conmigo,2nkt9YEkylrH40pFCeOVJd,"boom bap espanol, rap conciencia, rap politico, venezuelan hip hop"
Because Of You,6CFPFnS9EcLs2I0nWqtWci,"dance pop, pop, r&b, urban contemporary"
Bread & Water,7sWp37WaRYUsEg0QLjtXeM,"classic texas country, new americana, outlaw country"
