Song Name,Song ID,Genres
Tal Vez Quizas,4Ft4AbNwk1acKagaBOmvHb,"latin arena pop, latin pop, mexican pop"
"Overture (Suite) No. 2 in B Minor, BWV 1067: VII. Badinerie",3kvBEbswxMAx6QKc10SCon,"baroque, classical, early music, german baroque"
Bia' Bia' - Remix,1Un1dsZkA9cfZMLOXOyUBc,"atl hip hop, atlanta bass, crunk, dirty south rap, old school atlanta hip hop, southern hip hop"
Love Me Do - Mono / Remastered,4aX3n1Pn6jiCbvqBL8eqyP,"beatlesque, british invasion, classic rock, merseybeat, psychedelic rock, rock"
Stay,789CxjEOtO76BVD1A9yJQH,"barbadian pop, pop, urban contemporary"
Da Enemy,1qm8gshOp7RkwP47WRukrS,"alternative hip hop, bronx hip hop, hardcore hip hop"
Nací Con Suerte De Rey,7vwyZsnk1A1DMQ7oMFDg1Z,"banda, musica mexicana, norteno"
The Ballad Of John And Yoko - Remastered 2015,1F7s27lLKshLPt9TPCgMDL,"beatlesque, british invasion, classic rock, merseybeat, psychedelic rock, rock"
Bringin' Da Noise,0MxKHJEhhFOJsvYak4Q5Bu,"boy band, dance pop, pop"
I Thought She Knew,0b4u7IhBY61kSmS8wVIPYg,"boy band, dance pop, pop"
Emotional,7ge7BHazYbVKi8qyZUX1Bm,"atl hip hop, atl trap, rap, trap"
"The Wheat - From ""Gladiator"" Soundtrack",4sTSfR2cq7gUxUbiU1w60F,"ethereal wave, neoclassical darkwave, oceania soundtrack, soundtrack"
龍捲風,4eLCzybaneILH1zBkwwQyZ,"c-pop, mandopop, taiwan pop, zhongguo feng"
Something - Remastered 2015,7mzNk14FElnA5DOKQyBrM0,"beatlesque, british invasion, classic rock, merseybeat, psychedelic rock, rock"
Turn Off The Light,7dsImih2L25fa6qjNphBI7,"bass house, edm, electro house, house, melbourne bounce, pop dance, progressive house, tech house"
Piquete de Ojos,2FE0rf6Q3vgLcKJmu2jHh9,"corrido, musica mexicana, norteno"
Vampires,26uwjXS3gdxAIceTXWrXAO,"banda, cumbia sonorense, musica costena, musica mexicana, norteno, tejano"
All You Need Is Love - Remastered 2015,6KqiVlOLfDzJViJVAPym1p,"beatlesque, british invasion, classic rock, merseybeat, psychedelic rock, rock"
Ecstasy,1E0CZWim9mfwrCkXvieES8,"brostep, canadian electronic, dubstep, edm, electro house, progressive electro house"
Elevation,6mpc681Hb9vbr4tFZJ7Jfc,"smooth jazz, smooth saxophone"
On My Way,3OjNkFFZavF89xvRqWCXmU,"classic texas country, contemporary country"
Don't Tell Me,6E6uwOhAEHSzSvDewOBEvF,"album rock, classic rock, glam metal, hard rock, heartland rock, soft rock"
Eight Days A Week - Remastered 2015,5ylLypaOksxWd75YrGtx2N,"beatlesque, british invasion, classic rock, merseybeat, psychedelic rock, rock"
Everyday,2N3U8uTYhjX2KwGT0pf5x0,"east coast hip hop, hip hop, rap, trap"
Me Ilusione,20jSoyCuEIjuq9eKCYHpLK,vallenato
In The Jailhouse Now,7nCfgsjUCQUogw3MY5tEeR,outlaw country
Vinyl,2q2kwEh9flpSMwwqpPYCC3,"smooth jazz, smooth saxophone"
Riding With the King,0U6wNkZaQUTBrCLbhbbRgS,"album rock, blues rock, classic rock, electric blues, mellow gold, rock, singer-songwriter, soft rock"
Lux Aeterna,18zjwSgYiwu1Meb7Po3tUP,"hard rock, metal, old school thrash, rock, thrash metal"
Penny Lane - Remastered 2015,7afyyi8zn4FzWbcJ70F56V,"beatlesque, british invasion, classic rock, merseybeat, psychedelic rock, rock"
What A Day,3v3gyQkwRQGwDUZ7V2q2lF,"hip hop, rap"
The Wicker Man - 2015 Remaster,7e33IaVp4FKTTwOEKqsqEI,"hard rock, metal, nwobhm, rock"
"Life in the Ruins for Piano (From ""The Legend of Zelda: Breath of the Wild"")",1HD7Vgyc6ZKgS4KO7vIPQZ,vgm instrumental
"String Quartet No. 13 in B-Flat Major, Op. 130: II. Presto",2ZjhhB3kZP6Zufmjuv2TWC,"classical, classical era, early romantic era, german romanticism"
In The City Life,4l5uxmrBy57ccTRyF8K1lJ,smooth jazz
"Alkaholik (feat. Erik Sermon, J Ro & Tash)",2jKoVlU7VAmExKJ1Jh3w9P,"detroit hip hop, g funk, gangster rap, hardcore hip hop, hip hop, west coast rap"
In Your Own Sweet Way,5Y8XLhYm4ZeMU25Rg24YoH,"hard bop, jazz, jazz guitar"
Laredo,4T9ej7a6gtJyQ5yFRO1vXc,
More Than Anything,2B1Tx8yV3jAJqQXxR8B1An,sleep
Crawling,57BrRMwf9LrcmuOsyGilwr,"alternative metal, nu metal, post-grunge, rap metal, rock"
I Want Candy,2FMcDUopGfjBh3xMsrm78S,"new romantic, new wave, new wave pop"
Omen,4kuPeLqTPXDkPB2injreCw,"edm, house, indietronica, uk dance"
Lady Madonna - Remastered 2015,1raiIrqaqRAqZmQWZlLuBd,"beatlesque, british invasion, classic rock, merseybeat, psychedelic rock, rock"
The Game,2wGSgTmgSF3xjRrHkTc25R,"detroit hip hop, gangster rap, hip hop, pop rap, rap, southern hip hop, trap"
Ball Of Confusion (That's What The World Is Today) - Single Version/Mono,6SN51pk4UOfKa9Q9DoXEtF,"memphis soul, motown, soul"
Tu inolvidable sonrisa - Con banda,5HUXSbMwR3wRlJQ5JwJRXF,"grupera, mexican rock-and-roll, norteno, ranchera"
Morning Bell,4h37RgtBg9iynN3BIL5lFU,"alternative rock, art rock, melancholia, oxford indie, permanent wave, rock"
"Where Are You Christmas - From ""Dr. Seuss' How The Grinch Stole Christmas"" Soundtrack",1msuiw6pnXYfxZ7Edyit9U,"contemporary country, country, country dawn, country road"
"Beethoven: Symphony No. 6 in F Major, Op. 68 ""Pastoral"": I. Erwachen heiterer Empfindungen bei der Ankunft auf dem Lande. Allegro ma non troppo",5UbN3fe9OB1p5KwjgUAHD4,"classical, classical era, early romantic era, german romanticism"
Somebody Already Broke My Heart,6bFGd2OxhPMgarpYVVncRC,"british soul, sophisti-pop"
Fuego A La Jicotea,4Q0uMeNsbChj1IbETdMQZ7,salsa
Digno,0UqzSQKlgsGXxhsZK00SfL,"latin christian, latin worship, rock cristiano"
Rose,4FEr6dIdH6EqLKR0jB560J,"alternative metal, nu metal, rap metal, rock, sacramento indie"
"Left, Right, Left",0vk5b6kj3QISHg4fpRPi6n,old school atlanta hip hop
You're The One For Me,6HtsA6ZSbdaLoYswmXfPiM,smooth jazz
Gettin' In the Way,5Kjf7kWia6Ey8nRM4Mgj5l,"hip pop, neo soul, quiet storm, r&b, urban contemporary"
Fear,0GMiRrUnQuoGddKMsxGPIZ,"classic oklahoma country, modern country pop"
Bananas and Blow,5UWcIBGizE1JNnDrXC7L1Q,alternative rock
911 (feat. Mary J. Blige),28hgx2bWXcaBJeC9zVwrBq,rap kreyol
saw the future,12LpWREnN42vmvU4Vmgbhu,
There Is No Arizona,7Hgcw6qYU1ukRdRGvEkJk3,country dawn
Is That Your Chick (The Lost Verses),4aWxp4mBOnWIUDlXb4ngaV,east coast hip hop
Young God,5x2XIAdvFxWCwIOMNkbWUj,"electropop, etherpop, indie poptimism, pop"
Country Grammar (Hot...),3wMUvT6eIw2L5cZFG1yH9j,"dance pop, gangster rap, hip hop, pop rap, rap, st louis rap, urban contemporary"
Yes!,6vN77lE9LK6HP2DewaN6HZ,"atl hip hop, atl trap, rap, trap"
Girlfriend - Single Version,38bP8r9yx49g6pdQ90NH1X,"contemporary r&b, new jack swing"
Let It Go,13HVjjWUZFaWilh2QUJKsP,"neo mellow, pop, uk pop"
At the River,0KIPa0YuQ5QFmlAqRyXNd9,"big beat, electronica, nu skool breaks, trip hop"
Flow,0De9jFjJ4eRLl7Yww2eBw1,modern country pop
The Fox,5HOpkTTVcmZHnthgyxrIL8,comic
Big Boy Toys,1vEpm2t75VL7Xl5h59q0L4,"country, country road"
Te Esperaré,4TQmC5JxF3eq9kfsdQVtfp,"banda, grupera, gruperas inmortales, grupero romantico, musica mexicana, norteno"
Walk On,5p3JunprHCxClJjOmcLV8G,"classic rock, glam rock, permanent wave, rock, singer-songwriter"
Ticket To Ride - Remastered 2015,7nhrlsT1P4qsslp28UA1BI,"beatlesque, british invasion, classic rock, merseybeat, psychedelic rock, rock"
Dejenme Si Estoy Llorando,0YvKdz58OcwgYdS67NJkkU,"chilean rock, mexican rock-and-roll, nueva ola chilena, ranchera"
Dinosaurs Will Die,4kRDPODRnN9Cbyrcg9qTkE,"punk, ska, skate punk, socal pop punk"
Terrapin,44syVsiS6uTaLRDbr1QIfr,"downtempo, electronica, indietronica, instrumental hip hop, jazztronica, nu jazz, trip hop"
"Plumskinnz (Loose Hoe, God & Cupid)",7DSsaRZxLCOGvebOJGxaAw,"alternative hip hop, golden age hip hop"
Walking Away,3R7fjB38qajI6JR69y5k4e,"british soul, talent show"
Vivica,0bluBeWPM2Hm38MHsim1jW,riot grrrl
Playas Gon' Play,3OWsm3HE35S9x3fgY8tbgh,"contemporary r&b, girl group, hip pop, r&b, urban contemporary"
Si Nos Dejan,7nAvryV9PVCt9PQGPx7I0z,"bolero, latin pop"
"Resurrection (Paper, Paper)",48u1HrXNWbKLhcquhI8Pjx,"gangster rap, hardcore hip hop, hip hop, ohio hip hop, rap"
Avenue,3hAGmPnGix8RTb1vy5qZcb,"r&b, rap"
I Hear You Calling,7KsLCoGgjP1tsGPJuvi2SX,"canadian pop punk, canadian punk, skate punk, vancouver punk"
Oogie Boogie's Song - Soundtrack,0nqlmP6z9O9K3LXx07KIao,
La danza del fuego,0dQPkfweyWDzZ20Auq3F14,"celtic metal, medieval rock, rock en espanol, spanish folk metal, spanish metal"
Not the Same,4NhpT1ZDvHYJtpG1XyVMFn,
La Campanera,0AVoDNqfSnqqZjHgdqmj10,"chicha, cumbia, cumbia salvadorena"
Makes No Difference,0dEKHXkMPrC5vQkjPtmOic,"alternative metal, canadian pop punk, canadian punk, modern rock, nu metal, pop punk, post-grunge, punk, rock"
Polly Put the Kettle On,7gH0AalGuL5JdoIv2CrBM4,"children's music, preschool children's music"
El Pastor,4r7V9rY0u9Vn3y9E928Ehr,"bolero, mariachi, ranchera"
Peace Train,4d0d2llNcQIHmaCgYTrODQ,"british folk, classic rock, folk, folk rock, mellow gold, singer-songwriter"
3030,39GBFwBe4GGk7i3yr3F46P,"abstract hip hop, afrofuturism, alternative hip hop, hip hop, psychedelic hip hop"
Family Reunion - Live/1999,5TyHeZpXFaweWQxaihvmwH,"alternative metal, modern rock, pop punk, punk, rock, socal pop punk"
Our Way to Fall,5CSWXnKRzx7vI4S4JFAunl,"alternative rock, art pop, dream pop, indie rock, indietronica, lo-fi, new jersey indie, noise pop, permanent wave, shoegaze"
Nocturne No. 10 In E Minor,5Q6Yl87BTK0wbGY7XGFZhx,"british classical piano, classical piano"
Stranger in My House,3byhGb1jyYOj8uNhA1UXoO,"classic country pop, country, country road, country rock, nashville sound"
"Hello, Goodbye - Remastered 2015",0hqjsgWRfMBf2s8xsvRq1M,"beatlesque, british invasion, classic rock, merseybeat, psychedelic rock, rock"
That's When I'll Stop Loving You,3TnT4ULnE2bzJG40gUtZh6,"boy band, dance pop, pop"
Solitary Man,4fGY24H3cfYLDemnkRrsf1,"adult standards, brill building pop, folk rock, heartland rock, mellow gold, singer-songwriter, soft rock, yacht rock"
Quiero Ser,6ShG9Ax6jFZ9uNguIUp0FU,"gruperas inmortales, musica mexicana, nu-cumbia, ranchera, tropical"
From Me To You - Mono / Remastered,1euKWJfJSfPhgSendPrcXb,"beatlesque, british invasion, classic rock, merseybeat, psychedelic rock, rock"
Heavy Things,12gHzpb83V2Eh6D2sKUPlU,jam band
I Miss You So,7h7dHMkX9ja9rQZWMHQd2G,
Souvenirs,0MVd25c75PYKsta1f19ZoK,
Don't Think I'm Not,487Dyzs7Xbbk4hIWYyYT80,"contemporary r&b, hip pop, r&b"
Volare,5OkKOkdVTKFrYi6GWXkMzR,"adult standards, easy listening, lounge, vocal jazz"
One Step Closer,3K4HG9evC7dg3N0R9cYqk4,"alternative metal, nu metal, post-grunge, rap metal, rock"
2 Joints,4DIJFsSkAbBNoxxFB8G4Fo,"chicano rap, latin hip hop, texas latin rap"
Crazy for This Girl,53z0hOqr2yeSj3ZqCdiYNg,pop rock
El Gallo de Mil Palenques,6Vin1rKJeZJ2a4zk9gLu82,"corrido, musica mexicana, norteno"
Back on the Train,1NVlLhQzlB6c8MAsSKncft,jam band
Feel Like Makin' Love,3KPwt1LBpt1jVSHz8GXERo,"album rock, classic rock, country rock, glam metal, hard rock, mellow gold, rock, singer-songwriter, soft rock, southern rock"
Drive - Acoustic,2Yzw1oQwuCJDglARieFOEY,"alternative metal, alternative rock, funk metal, funk rock, nu metal, post-grunge, rock"
Recognize,1DMYEiuAgz1OKvANXiNFrN,"r&b, rap, urban contemporary"
In A Little While,0vyVsDtLIJmq3kV3oz66dr,"irish rock, permanent wave, rock"
Flamboyant,4sw7D73E8KHAZVQxRNJArP,"east coast hip hop, hardcore hip hop, harlem hip hop"
Mi Obsesión,2MyrAbBOzzGebafCtz7xz9,"cumbia sonidera, grupera, musica poblana"
至少還有你,0fGM6yMJ1swPXt5NI0GCdl,"c-pop, classic mandopop, mandopop"
Sure Thing,0JXXNGljqupsJaZsgSbMZV,"r&b, urban contemporary"
You Are My Sunshine,4cNpO3kF8rqcH8G3huFCJp,pop
You Said Something,4m5S4wvLY031rN6beIWoRe,"alternative rock, art pop, melancholia, permanent wave, piano rock, singer-songwriter"
Yellow Submarine - Remastered 2015,7zRmGvtSy36Jr19U5OInJT,"beatlesque, british invasion, classic rock, merseybeat, psychedelic rock, rock"
Te Voy a Hacer Feliz,4jBkRRscUmbKtUbngf2WQf,"salsa, salsa colombiana"
G'd Up,7yBHF3ehNxm6E3MVY3SWCR,"gangster rap, hardcore hip hop, hip hop, nyc rap, pop rap, queens hip hop, rap, southern hip hop"
Feel Good Hit Of The Summer,7qTZ3NYt0p2Bdyaq4YS6UL,"alternative metal, alternative rock, grunge, modern rock, nu metal, palm desert scene, rock, stoner metal, stoner rock"
Million Miles Away,6tNeHmedp9qo3BsBp5zOPe,"alternative metal, permanent wave, post-grunge, punk, rock, skate punk, socal pop punk"
Dead Souls,12s8P9IFXjJWwVnX7u26ca,"alternative metal, alternative rock, cyberpunk, electronic rock, industrial, industrial metal, industrial rock, nu metal, post-grunge, rock"
Steve Berman,0DaZU7iKgXMelfXCkCOgBK,"detroit hip hop, hip hop, rap"
Sick Of Life,0lM0UP8cjGvrnS25NvFFWc,"alternative metal, nu metal, post-grunge, rap metal"
Sin Ti,0E7Ue4jKLBSNnHfpb5qLS0,mexican hip hop
Strawberry Gashes,6BbUeBm35cYoGUy70rqsG8,riot grrrl
開始懂了,68tZwwRuo9ip5gRQFG1XWF,"mandopop, singaporean mandopop, singaporean pop, singaporean singer-songwriter"
Zoom,3VFGA65JnN8EDmnRb5SHW2,"hip hop, melodic rap, philly rap, rage rap, rap"
Tiny Cities Made Of Ashes,1EbUYOmJkqKgUYgC2OI7Tc,"alternative rock, chamber pop, indie rock, indietronica, modern rock, washington indie"
We Fall Down - Live,1HXzXYbhLDdpFkJyBxEjIF,gospel
Because of You,6CFPFnS9EcLs2I0nWqtWci,"dance pop, pop, r&b, urban contemporary"
Open Up,4QTwWQDW89udp0JDO2lmPI,canadian contemporary r&b
"Luv Me, Luv Me",7hV4x7PMKGC4qD3NWLt2UJ,"pop rap, reggae fusion"
Come Together - Remastered 2015,3CEFDHJSiERlfwRujZ1CkJ,"beatlesque, british invasion, classic rock, merseybeat, psychedelic rock, rock"
"Independent Women, Pt. 1",69XUpOpjzDKcfdxqZebGiI,"dance pop, girl group, pop, r&b, urban contemporary"
Macy's Day Parade,3zca0nsKOLnN28ftZEXAQn,"modern rock, permanent wave, punk, rock"
Juventud,6XGVwHELAvx2LYv3uAH7DV,"gruperas inmortales, musica mexicana, nu-cumbia, ranchera, tropical"
Que No Me Faltes Tu,03gTQmd2iDkbeZXxcjn9jZ,vallenato
The Leanover,0lE2Jl13AfiAONJKrrXDxD,"scottish indie, scottish rock"
Ante Up (Robbin Hoodz Theory),550JPXXPgjr1xqxtKIaX6b,"east coast hip hop, hardcore hip hop"
Weak Azz B***h (feat. La Chat),5RpKjxkf6PWTWelPlfHwa3,"crunk, dirty south rap, gangster rap, memphis hip hop, southern hip hop, tennessee hip hop, trap"
反方向的鐘,5CrShYXYibJD0kx4q56xhZ,"c-pop, mandopop, taiwan pop, zhongguo feng"
My Everything,4eumFsTnduH3zRfaASoAPs,pop
Highschool Lover,366QpkppDb9f5TVamPSpgH,"ambient pop, downtempo, electronica, indietronica, trip hop"
It's Love,2U7X7mPD4wSp0capCGfpmM,"hip pop, neo soul, quiet storm, r&b, urban contemporary"
Give Me Jesus,0PKyLZzVgzjhNMKXekDpSi,"ccm, deep ccm, instrumental worship, world worship, worship"
Quality Control,5MPPttjfGap2C6j6eKcO6J,"melodic rap, trap"
My Only Wish (This Year),0YWUHZPJVg4iujddsJDwhM,"dance pop, pop"
It'll Be OK,2KnLkZ3z7PO3kgVGHGqDpD,"canadian pop, pop, viral pop"
Cuando nadie me ve,7sNpt6AvOvXXZVaqTCFVCu,"cantautor, latin arena pop, latin pop, mexican pop"
Thank God I Found You - Make It Last Remix Edit,6nTcn8CybBcx0t7IaXEJ6O,"dance pop, pop, urban contemporary"
"24 Preludes, Op. 11: No. 14 in E-Flat Minor",3X8qM7wWcJ7z1EF7YWOWkb,"classical, contemporary classical, early modern classical, impressionism, late romantic era, russian romanticism"
可愛女人,4RbjlqzGc5piUTTr32XMlv,"c-pop, mandopop, taiwan pop, zhongguo feng"
黃昏,4mronxcllhfyhBRqyZi8kU,"classic mandopop, mandopop"
Monster Mash,0xxZY5C9xxij3D1HkzbnfC,"halloween, novelty"
De Gloria en Gloria,2V1SFgnMxjtun5s9K4w4uc,"latin christian, latin worship, rock cristiano"
Who Run It,3uhJIV80m8oKkuyvvS6rw2,
Quien Eres Tu?,0D0hqpMEi4aHukh8zP5gSF,"bachata, bachata dominicana"
星晴,4VWn7L2kONeMEQ6cAIfzXC,"c-pop, mandopop, taiwan pop, zhongguo feng"
This Can't Be Life,4UPyqSVCf0ukiBbi0MvLDW,"east coast hip hop, gangster rap, hip hop, pop rap, rap"
Gasoline Dreams,1Jo3u8eXp8xobbrvq0FIi9,"atl hip hop, dirty south rap, hip hop, old school atlanta hip hop, rap, southern hip hop"
You Make Me Sick - Radio Mix,1icygp76kVbs429RikF0jJ,"dance pop, pop"
I'm so Hi,4vt0bSxOcbtF26WHijqlGA,"crunk, dirty south rap, gangster rap, memphis hip hop, southern hip hop, tennessee hip hop, trap"
Anything Goes,46ZfPS5VpSQVU5gb82hg3K,"contemporary country, country, country pop, country road, modern country rock"
Main Offender,4N9NC8JCz2hSimtbspc6Ng,"alternative rock, garage rock, garage rock revival, modern rock, rock, swedish garage rock, swedish hard rock, swedish indie rock"
Dicen Que la Distancia,4x9VAqNreqcfxBLeNj2f2C,"grupera, musica mexicana, ranchera"
Amargura En La Sangre,3yrM3zMH82LpNOvOF4BKOn,"cumbia sonorense, musica sonorense, tecnobanda, tejano"
Aquí,33vrRiIiut4rOFmkgorJD6,sad sierreno
What It Is,73RbfOTJIjHzi2pcVHjeHM,alternative r&b
Microphone Fiend,0cSJGFChou7M6u2ju9SWN1,"bboy, east coast hip hop, golden age hip hop, hip hop, old school hip hop"
This Is Halloween - Soundtrack,5qwgxrNbhYCDpCV14qXs8e,halloween
Country Bumpkin,5TQ1qGqblpxBL0dVhLda2y,"classic country pop, classic oklahoma country"
後來,2wzXhxWPX0aODraKNXoJYY,"mandopop, taiwan singer-songwriter"
Enamorado De Ti,3pY68z0dH4i4gF1zzONS0q,"grupera, musica mexicana, ranchera"
My Shit's Fucked Up,35UT9ZB7UROy8W8JvMmzMD,"country rock, folk, folk rock, heartland rock, piano rock, roots rock, singer-songwriter"
I'll Be Good For You,7Dt3YcGl01jAdxJrIXf0T6,"boy band, dance pop, pop"
The Lighthouse's Tale,05HjafWVI238CLw5RDNkas,"bluegrass, instrumental bluegrass, mandolin, progressive bluegrass"
Papercut,1Vej0qeQ3ioKwpI6FUbRv1,"alternative metal, nu metal, post-grunge, rap metal, rock"
Y Yo Sigo Aqui - Spanglish,2AqMYV57Zmk9fYiPv6GeQV,"latin arena pop, latin pop, mexican pop"
Da Baddest Bitch,1rBittbf1aWwzeW28dI7Lv,"contemporary r&b, dirty south rap, hip pop, miami hip hop, r&b, rap latina, trap queen"
Red Rum,6WrB9GxMErfWdrRpMh2LlB,dark trap
El Tarasco,7qkl7zanDubz7DvzLFRr8Z,"banda, musica mexicana, norteno"
Psychedelics,225BSqkRnhGgqV2uWQiBRs,
Keep On The Sunny Side,3uHV4rbEWjIkNTn3qTPt0d,
Gone Sugaring,5BXGrZKY39Vs8IMrpmI75K,olympia wa indie
I Hope That I Don't Fall in Love with You,23Uv9xqLumDqEBNIdHhCcO,"folk, singer-songwriter"
Tiny Dancer,2TVxnKdb3tqe1nhQWwwZCO,"glam rock, mellow gold, piano rock, rock"
AM Radio,03gsb1WnVQUuLqChBvzmoo,"alternative metal, alternative rock, nu metal, permanent wave, pop rock, post-grunge"
No Te Detengas,0p0fvQgOyFY4N6TAVGbn5m,"bachata, bachata dominicana"
Fiction - Dreams in Digital,6NldY5aZigWeeGIMY41qG6,"alternative metal, electronic rock, industrial metal, industrial rock, nu metal, post-grunge"
Spinning Around,0JcgDliDqDac8iOFFRm7tZ,"australian dance, australian pop, dance pop, eurodance, new wave pop"
Demasiado Tarde,02u1DxSAbncpXFIiYcCmGL,"reggaeton, trap argentino, trap latino, urbano latino"
Come On Let's Go,6f44p3Kc4ayD9VtbC9Clkr,"hip hop, rap"
Reflections After Jane,4tvcK5VeTECYIepVxloVSG,"chamber pop, melancholia"
La Peda,7GMfMtCmum0esRzMTI19nv,"banda, musica mexicana, norteno"
Good Love,0ZVjgfaC2Ptrod9v6p9KFP,charva
My Life in Art,14Zab7jJKwK89fY4RxXl3N,"dream pop, slowcore"
Supa Freak Love,5w02nBF8o9RYWXba6026sd,"industrial metal, nu metal, rap rock"
(Rap) Superstar (feat. Eminem & Noreaga),7ivM5ILtz3k5Z6sRjXu0v2,"chicano rap, gangster rap, hip hop, rap rock, west coast rap"
Ain't No Mountain High Enough - Edit Version,5PIgwTDsrWXvW7VU6QCEOf,"adult standards, disco, motown, quiet storm, soft rock, soul"
Keep'n It Real,7cvop8FcQdqP6qfVmQLkdD,"pop rap, reggae fusion"
Little Bird,44SDwuvTP3NeCmigJAyYnO,"boy band, pop"
Both Sides Now,2xSfwtV4mUr2h63Q1zJH58,"american folk revival, folk, folk rock, mellow gold, singer-songwriter"
Samba Tranquille,5a8Ir2wo8GpDDSkWqvZi7S,"downtempo, electronica, livetronica, trip hop"
"Up Where We Belong - From ""An Officer And A Gentleman""",4U6mBgGP8FXN6UH4T3AJhu,"album rock, blues rock, classic rock, folk rock, heartland rock, mellow gold, rock, singer-songwriter, soft rock"
Entre Pericos y Gallos,4cDL8SfFiCoFU9xc5nLzRC,"musica mexicana, norteno"
Hard Time Killing Floor Blues,3rlPaBlRjyNKHzJsvKV6dP,"country blues, louisiana blues, new orleans blues"
Lala,7ABLbnD53cQK00mhcaOUVG,"reggaeton, trap latino, urbano latino"
Deora Ar Mo Chroí,0jVDUBHY2SziMS3MwhKBpJ,"celtic, middle earth, operatic pop"
Without You,1KMkcUvF7m3SDChDOa7i5L,australian hip hop
Humble Mumble,5cN4KyXGUdNOve1TEPWmhL,"atl hip hop, dirty south rap, hip hop, old school atlanta hip hop, rap, southern hip hop"
Fuertemente,1kF34yKV0LkA6yS0FZuEhz,"banda, musica mexicana, norteno, tejano"
Drag You Down,3JdtnzG1qxSugpXwNuoo9v,"alternative metal, canadian rock, funk metal, nu metal, post-grunge"
Gravity Of Love,3RSMFb9dHXNWZw8YwYGepI,"downtempo, gregorian dance"
Learning To Breathe,3rQvHJ2K1g9tnIcL51eEWE,"ccm, christian alternative rock, christian music"
Bring Me Your Cup - Edit,0ffQpiShZZKtDN06L84FCJ,"reggae fusion, uk reggae"
"Vesperae solennes de confessore, K. 339: V. Laudate Dominum",7aHOmybSL7OvujPad7cBDW,"classical, classical era"
Spanish Guitar,1ieouFxB2A3JjKEt1OoEiB,"contemporary r&b, dance pop, r&b, urban contemporary"
Maan! (feat. E.S.G. & Big Pokey),2t14hckwDdy45OKVv957Tn,"chopped and screwed, dirty south rap, houston rap"
My Life,4ZoBC5MhSEzuknIgAkBaoT,"album rock, classic rock, heartland rock, mellow gold, piano rock, rock, singer-songwriter, soft rock"
We Don't Die,3IdNXr9qRDzFuWnW4jGlHe,horrorcore
Te Quiero Más,645n7uBH7EVl2UIBR24Mi7,"banda, corridos clasicos, musica mexicana, norteno"
Internal Primates Forever,1mhwzvD3iVSR1SUOemLAHc,"alternative metal, industrial metal, nu metal, rap metal"
"3 Nouvelles etudes, Op. posth.: II. Etude No. 26 in A-Flat Major",3S9qdWjfdG7HYbJtiWRRHe,"classical, early romantic era, polish classical"
Spanish Joint,4euxFlxLWVGmZZLyYARTyE,"indie soul, neo soul, soul"
I'll Go,5rahQ4uZfnRLcUKOWHinxU,"anthem worship, christian uplift, deep ccm, world worship, worship"
Reach Out I'll Be There - Single Version / Mono,0PpamSdfQzIAvj5OB9Bz54,"classic soul, disco, motown, quiet storm, soul"
Now 'Til Forever,4L2lzMYxwE4ObPozyV1idl,"jazz saxophone, jazz worship, smooth jazz, smooth saxophone"
I Wanna Be With You,2EAHXJbcFLmREbJCTv2RnD,"hip hop, miami hip hop, pop rap, rap"
Cooking,2Dgfey8RouHR9ziGmThLli,"edmonton indie, lo-fi indie, pov: indie"
Le Monde,424DkevE18QJazwlljiTD4,
De Paisano A Paisano,2k9VZEnDLNCNou3wjIjxE0,"musica mexicana, norteno, ranchera"
The One,6hkOqJ5mE093AQf2lbZnsG,pop
Goddamn Electric,5b3mIPS9eqmMfuoOr7JNkp,"alternative metal, groove metal, hard rock, metal, nu metal, old school thrash, rock, texas metal"
El cariño que perdí - Con banda,5v7wr5jovWGg46cL2YTN6Q,"grupera, mexican rock-and-roll, norteno, ranchera"
Devil's Pie,5ILWEn8WXPezgpHkGHDk8s,"indie soul, neo soul, soul"
Waiting For My Real Life To Begin,14Yt3KfCCbtpgUkKPgKJMc,solo wave
Elysium,7snyEEkuqPgQoJApi3iQ50,"german soundtrack, orchestral soundtrack, soundtrack"
Cinco Lágrimas,2V2jMQgPJgUH7TA1fW0n5x,"banda, musica chihuahuense, musica mexicana, norteno"
Papercut - Live at BBC1,5SDOPP5zCdggONUuYWiiTS,"alternative metal, nu metal, post-grunge, rap metal, rock"
The Worst Day Since Yesterday,5S1qWBPGQoktlmFd6bj3JY,"celtic punk, celtic rock, punk"
I Lost It,2k6ahrUpg8CbeTjLocMQJ4,"contemporary country, country, country road, modern country rock"
Maybe Someday,50hpyfKEhm7ozpvgV0ZAFE,"new wave, permanent wave, rock, uk post-punk"
Shout 2000,1lgQ7wpNDxSukuT4cgYrfW,"alternative metal, nu metal, rap metal, rock"
"Grim, Grinning Ghosts",6BGIYRM9XSFgbQrBtsxuQa,
"He's a Bird, He's a Plane",4rJ0ql37oCyxpBYZ3KGOgr,"chicano rap, latin hip hop, texas latin rap"
The Night,0QZ5yyl6B6utIWkxeBDxQN,"indie folk, modern rock, stomp and holler"
Change Your Mind,2MNG8spWd2fgvokW8EZDod,gen z singer-songwriter
"24 Preludes, Op. 11: No. 11 in B Major",5jIhONIFFyh6zXsyxovpAH,"classical, contemporary classical, early modern classical, impressionism, late romantic era, russian romanticism"
Wobble Wobble,6HTayRIlcznHDk8D1LARDg,dirty south rap
Nothing To Gein,099F8DBwudywg5KK6WVFox,"alternative metal, industrial metal, nu metal, rap metal"
Great Is Your Mercy - Live,62DNye6dXRsmZNVJaXZYc5,gospel
"Ryde Or Die, B****",28TaYSTqNY96c2oyUyAwwg,"dirty south rap, east coast hip hop, hardcore hip hop"
So This Is Love,0gsBQy8Q0eWlR67xDmoWFw,new age piano
El Rey Del Cristal,0VoevOTSW7bqLPL7chqvbo,"banda, musica mexicana, norteno"
Come Out Swinging,3T8Ht5f3xUejqEctN3RGb6,"alternative metal, permanent wave, post-grunge, punk, rock, skate punk, socal pop punk"
Down with the Sickness,40rvBMQizxkIqnjPdEWY1v,"alternative metal, nu metal, rap metal, rock"
One Fine Day,6vcG9EgeqJUSmmF65lxUm6,"brill building pop, classic girl group, doo-wop, rock-and-roll"
Aaron's Party (Come Get It),4fF34Yf5KsfUbCORyLGpEj,post-teen pop
Why Pt. 2,7ldnttFcRZRgfLSNmDbSSg,"alternative rock, grunge, pop rock, post-grunge, rock"
Bye,6n2P81rPk2RTzwnNNgFOdb,"corridos tumbados, sad sierreno"
Que Ganas con Llorar - con banda,1JC1Df8iZc9hASwSxcNvBE,"grupera, mexican rock-and-roll, norteno, ranchera"
Sweet Home Chicago,4lVnTUvCjxBwWE5Sbu6yPk,smooth jazz
That's What I Believe,6sX8nB5PoeXEXjQGKvHR1N,gospel
All I Have to Do Is Dream,7dblNGnRXEBrVJunazs2U5,"adult standards, folk rock, mellow gold, rock-and-roll, rockabilly, sunshine pop"
"Now We Are Free - From ""Gladiator"" Soundtrack",1raWfcURBd1Q3W3K0ojDCM,"german soundtrack, orchestral soundtrack, soundtrack"
Cumbia de los pajaritos,0fNwZHd0wq3eQEOppEqUEG,"chicha, cumbia, cumbia amazonica, cumbia peruana"
Flowers On The Wall,7ledv9CTjqdwnvHgRmETyZ,"country, country rock"
Untitled,5bBUDJUfGcG7eFy3Bf4fXv,"conscious hip hop, hip hop, rap, west coast rap"
Oh My Sweet Carolina,2Zcr8xMMZyNT5wMsj3SWmw,"alternative country, new americana, roots rock, singer-songwriter"
WW III,3vm7NBtMNULBDQ8yAwVoWC,"dirty south rap, gangster rap, hardcore hip hop, hip pop, southern hip hop"
I Wish,35SbrfbaSpGUBX7e5BPega,colombian pop
Don't Let Me Be the Last to Know,3OitWDgR4SzAUOm3TBmvhw,"dance pop, pop"
Stay Forever,3Yfx6OUnjz4dEtHdHxh4g9,alternative rock
October Road,0nILp5SpecXFvJQotZe48y,"classic rock, folk, folk rock, heartland rock, mellow gold, singer-songwriter, soft rock"
Trippin',346ittEDcO0iunrqX0iDi1,"melodic rap, pluggnb, rap"
Down to the Sea,5O3XZbXoPs3KD87OH3sO31,movie tunes
