Song Name,Song ID,Genres
Estrechez De Corazón,4oR2kX5BI50GBnQGRdRRsM,"chilean hardcore, chilean rock, latin rock, rock en espanol, ska chileno"
Work This Out,4k9EAtZdZrzPlBUsFncXCZ,"movie tunes, post-teen pop"
The General Specific,7kDhGzc1hgkQQyzpvBmKcX,"chamber pop, indie folk, indie rock, indietronica, modern rock, stomp and holler"
What Time Is It,6NqfslFfCCOyBQ0Xw8kN8E,"hollywood, movie tunes, post-teen pop"
Born for This,7uCBGNn991AM68fR4tSDco,"modern alternative rock, pov: indie"
King Of Wishful Thinking,4hnNT1qx5OpLgdMVDochHI,"easycore, neon pop punk, pop punk"
Breakin' Dishes,46aZJc0z1HHHSFxaIRxYSP,"barbadian pop, pop, urban contemporary"
Rise,51Grh1RyUDcMBbpuyUIUHI,pov: indie
Take A Breath,59zvcxSBbqfRE8ft9AZDcB,"cartoon, children's music"
He Said She Said,0jTTjg6q4jsd2RhuHwTvLj,"dance pop, pop, post-teen pop"
La Pelotona,0HUGDASmCfQ6SAN4WBr8wT,"latin hip hop, mexican hip hop"
So Much Better,3nfMOTjl5Ts1GZScRKuQnF,"broadway, country dawn, show tunes"
Wonderless,4QCczE24wLpDmPJ3qwwEvC,"pop punk, screamo"
Good Morning Baltimore,0XoVXIggK81o9urLqFc161,hollywood
Face Fisted,5tvdxJ8JpA9u4lKsLcUYKL,comic metal
Runaway,3DK6m7It6Pw857FcQftMds,"chicago rap, hip hop, rap"
Without Love,6REVaI9b1L8YATSTsGusgR,"hollywood, show tunes"
Sirens,7LSpFCvRZZot2AlmkUzy9k,"hip hop, rap, slap house"
Holding On,3C3cr2JQwXIhqAHqOardVO,"modern rock, pop, pov: indie, rock"
Light Up The Sky,7bnY0z3DPNHk3gfhLvAuvx,rain
Hypnotize - 2007 Remaster,6Tsu3OsuMz4KEGKbOYd6A0,"east coast hip hop, gangster rap, hardcore hip hop, hip hop, rap"
Soy Igual Que Tú (feat. Toby Love),4Zil8ro7fhQGVYXl2YYkO2,"latin hip hop, reggaeton, trap latino, urbano latino"
Blue Jeans and a Rosary,0xk2pGhKtVFY8bTdozH3bv,nu metal
The Carpal Tunnel Of Love,6FAUi2Xm6RCF0wpwG8oXGZ,"emo, modern rock, pop, pop punk, rock"
Electric Worry,7mQgJx5mfCuI6o8elrYCKg,"funk metal, modern blues rock, southern metal, stoner metal, stoner rock"
Walking Disaster,7xuhVUJmBpHR276Yc7AsgW,"alternative metal, canadian pop punk, canadian punk, modern rock, nu metal, pop punk, post-grunge, punk, rock"
Mañana Será Otro Día,7sHk2zV6klT9GukY4VKD4p,"boom bap espanol, rap conciencia, rap politico, venezuelan hip hop"
She Sings in the Morning,0CpjzuvY1fxcHPPgjrUNJu,"pop punk, screamo"
More Like Her,6vMiU1tMnWXkWlmMWjX6ZN,"contemporary country, country, country dawn, country road"
Blind to You,1HvqYpA3BpQcc8KJjAyxJl,"dancehall, reggae fusion"
La Travesia,1rl3fRHhwRMUX2PzHfhioY,"bachata, latin pop, tropical"
Vuelve a Llamar,6qQFOTKY0rpq7g8dUjNJ0N,"latin christian, rock cristiano"
Perdóname,6yLqoieklk9gwabLaUDJ4s,
Bette Davis Eyes - Re-Recorded,0kPeymTUiaidv48eRrMISu,"new romantic, new wave pop, soft rock"
Amiga,6kQYMqjobmB8MkWwa9OUyA,"cantautor, latin arena pop, latin pop, mexican pop"
Don't Jump,0pI4gDoplebJfO01uVGdok,german pop rock
Immigrant Song - Remaster,78lgmZwycJ3nzsdgmPPGNx,"album rock, classic rock, hard rock, rock"
Into the New World,1RTW9UthqmZwr8Od6CH4i8,"k-pop, k-pop girl group"
Se Ha Ido,0Xb0DjgzbsGEA6OMqijzkE,"banda, duranguense, grupera, musica mexicana, norteno"
Ticks,736KP0gdltJQWPKk0wVL7l,"contemporary country, country, country road"
Siempre te recordaré,2xERZiTuHMineyOlDrmlY4,"banda, grupera, musica mexicana, norteno"
Elevation,6mpc681Hb9vbr4tFZJ7Jfc,"smooth jazz, smooth saxophone"
"Listen (From the Motion Picture ""Dreamgirls"")",4z7Ja0RNran3XpIvc1PIQz,"pop, r&b"
Buddy,3mwvKOyMmG77zZRunnxp9E,"alternative rock, modern power pop, modern rock, permanent wave, rock"
Back Staba,34pB4FSvt545dwYbpbRkgd,"reggae, roots reggae"
You Wouldn't Know,0cnySM1Mlep9l9Y2fKo04w,"alternative metal, groove metal, industrial metal, nu metal, post-grunge, southern metal"
"Sweetest Girl (Dollar Bill) (feat. Akon, Lil' Wayne & Niia)",4liGjmhCupa7RP9JaQELYx,rap kreyol
Weekend Wars,19K3lUMJmOdeuOBTrbLm19,"alternative rock, indie rock, indietronica, modern rock, rock"
1973,1BV0m40U0M4t1SLIsDnwZl,"neo mellow, pop rock"
There! Right There!,41WDvgF7RgCXfLN9iKWVhp,
This Is The Life,7ycimCRcIumouxBwgsymjz,"indie rock, indietronica, irish rock, modern alternative rock, modern rock, northern irish indie"
