Song Name,Song ID,Genres
Bounce With Me - Edited Album Version,5jZfGxZDayFA1HzYmyOG3a,"dance pop, dirty south rap, hip pop, pop rap, r&b, rap, southern hip hop, trap, urban contemporary"
I Against I,5sNRPeIYoLJU5OSb7lSXPj,"black punk, dc hardcore, hardcore punk, nyhc, punk"
Against All Odds (Take A Look at Me Now) - Mariah Only,6PS1YRjdJ5Muakh2oh0UB2,"dance pop, pop, urban contemporary"
One More Time - Radio Edit [Short Radio Edit],0ijhkvBpA7OBlY4clWSUZw,"electro, filter house, rock"
I Lay My Love on You - Remix,0V82wcNlunw76nvvmPL9tk,boy band
Spaghetti Junction,1ZosUXeZM3qlTWdL1uTrhm,"atl hip hop, dirty south rap, hip hop, old school atlanta hip hop, rap, southern hip hop"
"Dammit, I Changed Again",2wInvm8hrvonqyArYUIpvi,"alternative metal, permanent wave, post-grunge, punk, rock, skate punk, socal pop punk"
Arrasando,2UxIztvGUN2Hd6gtZsVhnz,"latin pop, mexican pop"
Abusadora,6Zdjh0uRQPt22BPckJgvEj,"electro latino, reggaeton, trap latino, urbano latino"
Rest Stop,2bNnfnqNhy7dZXSbU1de8U,"neo mellow, pop rock, post-grunge"
Suzuki,7DBBuzCuZQaWNRix9ys6UB,"downtempo, electronica, trip hop"
Mad About You,5fBjPtOxhgdpU6LNWLyVHv,"neo r&b, soul"
Time Is Money,3apBIw6lP1VoekucpGnLOE,"chicano rap, latin hip hop, texas latin rap"
El Pachuco,1Dd7dAgpbNS0nDzVPAT275,"norteno, tejano"
Destilando Amor,6Gi35T5449ZbiGpzn9cfBl,"banda, cumbia sonidera, musica mexicana, norteno"
Lovin' Each Day,61fUmn6wYvU7qS62wNvQFN,"europop, talent show"
Imagíname Sin Ti,0LwCtv2JW5yTl5qd91e4tL,"latin pop, puerto rican pop"
Pretty Boy,7IL8PSVwLOJxqYne6azxQv,"modern alternative rock, modern rock, pop"
La Hummer De Culiacán,5Ca1kI9DGC9tjH7Yth2OPY,"banda, corrido, musica mexicana, sierreno"
Dark Center Of The Universe,3tuC2PqYsBplcBKKbl4X10,"alternative rock, chamber pop, indie rock, indietronica, modern rock, washington indie"
Greed,3rUGC1vUpkDG9CZFHMur1t,"alt z, pop"
O Death,16jWQYb9YpzdaOLG8DeHOB,"banjo, bluegrass, bluegrass gospel"
No One,6NvRxjfYkkT2SpirAlmsjH,"alternative metal, alternative rock, grunge, modern rock, nu metal, palm desert scene, rock, stoner metal, stoner rock"
New,0fv2KH6hac06J86hBUTcSf,"hip hop, rap"
Eye Contact,37bPydtyElNj0AERSVzGMM,smooth jazz
Ms. Jackson - Radio Mix,0AU0VWpaoihPEvxly76JVf,"atl hip hop, dirty south rap, hip hop, old school atlanta hip hop, rap, southern hip hop"
Cuando el Amor se Daña,4uq7AHJBZbXE6jqIVqQD5A,"merengue, salsa, tropical, vallenato moderno"
Echo's Answer,0mpKGswMW2MypC6kryHQmL,"art pop, chamber pop, dream pop, experimental rock, hauntology, indietronica, nu gaze, slowcore"
Heart A Fire,0622Am54SjfEZdSBtqicNv,
You're An Ocean,5awZBMKId8PN6ZrQh2Z3Rp,"pop rock, post-grunge"
Hellbound,2D3MiAYLyfO8K7jYpTXs0V,"modern southern rock, roots americana"
Ocean Beat,4QY0yRUFZH6esmilQ2B3xI,"downtempo, electronica, trip hop"
Penitentiary Philosophy,4Nngx0azfbJibdS5oT3dG8,"afrofuturism, alternative r&b, neo soul, r&b, soul"
Invincible,792HwhrdO3ErRKL5yRe4Ge,"brooklyn drill, rap"
Whirlwind Thru Cities,3uDa49zGfJFVXdBk9L5uQs,east coast hip hop
天黑黑 - Remastered,2wso0v7nIbeOnMf078XSVQ,"mandopop, singaporean mandopop, singaporean pop, singaporean singer-songwriter"
Shackles (Praise You),7JKEA8xYDoFp4q0QBW2PGg,"gospel, gospel r&b"
5 Bitches,79MmyTSmQOKzRxUGqDkgHb,
The Eyes of Ibad,3FK1eJKXboi8D8hOsWUZPk,diy emo
Yellow,3AJwUDP919kvQ9QcozQPxg,"permanent wave, pop"
Broken Home,029fIxcvELUWYCCUXLS0Zb,"alternative metal, nu metal, rap metal, rap rock, rock"
Casper Cha-Cha Slide (Live Platinum Band),0AaEbPXWdeiW6MbW80Eibj,kids dance party
Points of Authority,5egqKwgK5r5rvGD1LrtR7J,"alternative metal, nu metal, post-grunge, rap metal, rock"
God of Wonders,0TkFpOjGJCjmXJyDHC56Sh,"ccm, christian alternative rock, christian music"
"Drinkin' Problem (feat. Denny aka ""Steaknife"") (feat. Denny aka ""Steakknife"")",1PEFmn8Ft4xqhikDvXZiPz,redneck
Islands in the Stream,4mnOVRRXsaqg9Nb041xR8u,"classic country pop, country, country dawn"
El Triste,6HgUhIiqCepGzgb4nuses6,"bolero, cancion melodica, ranchera"
"Oh My Goodness, Look At This Mess!",0f9SOXX5YZr7NEMIjlIrWl,"gospel, women's music"
Give Me Just One Night (Una Noche),1OvjOVieEsYqGiK1T3mUv9,boy band
Mighty Healthy,2HvCL8hgJoHrrGAZEjQ3mM,"east coast hip hop, hardcore hip hop"
I Go Blind,0ye53FFhP3oRFuaz5Ubcop,"heartland rock, pop rock, post-grunge"
Me Llamas,5hEM0JchdVzQ5PwvSfITeX,"colombian pop, latin pop, reggaeton, reggaeton colombiano, trap latino, urbano latino"
Now or Never,7i2DJ88J7jQ8K7zqFX2fW8,"electropop, etherpop, indie poptimism, pop"
The Lost Souls,2yQkmsZyxw99iNzgbbkuOn,"alternative metal, nu metal, pop punk, post-grunge, punk, screamo"
Gold,5odlY52u43F5BjByhxg7wg,"modern indie pop, pov: indie, singer-songwriter pop"
Ven Conmigo (Solamente Tú),2PYJnUWEPPP8C6b79UiwIl,"dance pop, pop"
Twistin' the Night Away,7FS541dJh3iQAEXEZoDhE6,"classic soul, soul, vocal jazz"
Chain Gang,7v1858htfU0srTDwhxeka8,"classic soul, soul, vocal jazz"
Your Winter,4EDEJX1niW95xERzQgmgSG,"neo mellow, pop rock, post-grunge"
Breña,5uUlOIGQxxj1KS4dWJwzoS,"alternative metal, alternative rock, nu metal, rock, supergroup"
Holler,3z0dzcrMa0e9TpP6xxKwaU,"country rap, redneck"
Mr. Too Damn Good,0ayO9HLU8fRymoiFMVHqy3,"contemporary r&b, new jack swing, r&b, urban contemporary"
"EZ Come, EZ Go",1iDg5Sew5NGSxoIC7Qe5GT,memphis hip hop
The Right Kind Of Wrong,6bUdDs96w6E1ZhjlkEhDny,"country, country dawn, country road"
"Shut Up (feat. Duece Poppito of 24 Karatz, Trina, & Co of Tre +)",66MsAs4nVj68t6va1lygIm,"crunk, dirty south rap, miami hip hop, southern hip hop"
I Was Country When Country Wasn't Cool - (Duet With George Jones),3qd4eFbXvTs0xsgDnExC0I,"classic country pop, country, country gospel, country rock"
Groovejet (If This Ain't Love) [feat. Sophie Ellis-Bextor],1ftK0tLj4ZYKYxSzXk5Lpb,
Black Night,7yn7rpRvg6XCq10B94etIp,"album rock, classic rock, hard rock, metal, rock"
The Long And Winding Road - Remastered 2015,5xhP99gVBIkpr7omcdCeiy,"beatlesque, british invasion, classic rock, merseybeat, psychedelic rock, rock"
Perfect Disguise,1cQqX6dPyzsP8TCeT0auEu,"alternative rock, chamber pop, indie rock, indietronica, modern rock, washington indie"
Aire,1a8vNLzmwmy31iCT45MNkF,"banda, musica mexicana, norteno, tejano"
El meneíto,3YGIGjDzgeaqyt7JHuMgJT,"banda, cumbia sonorense, musica costena, musica mexicana, norteno, tejano"
"King Arthur, Z. 628, ""The British Worthy"": Air",3snc9m6T0b0TuxtSEsmP4U,"baroque, classical, early music, english baroque"
Sin Tu Amor,63hZCrRfcZza3npjwt3Ezs,"panamanian pop, reggaeton"
Tu Secreto,4AKtpixRxtQQhy7OCYJbhL,"bachata, bachata dominicana"
Lucha De Gigantes,4nheObMzE4K8AIxIICoLgd,"cantautor, latin alternative, mexican rock, rock en espanol, spanish new wave, spanish pop"
Auto-Mobile,0O3qGCkFwdvwznpQfFrio7,slowcore
Mi Gusto Es,59nRuCsjHNdHNrs6BMj3fR,"mariachi, musica mexicana, norteno, ranchera"
A Place for My Head,5rAxhWcgFng3s570sGO2F8,"alternative metal, nu metal, post-grunge, rap metal, rock"
Time After Time,7o9uu2GDtVDr9nsR7ZRN73,"dance pop, new wave pop, permanent wave, soft rock"
Bow Wow (That's My Name),5nwzfbcg8RPyZB72WwQBWA,"dance pop, dirty south rap, hip pop, pop rap, r&b, rap, southern hip hop, trap, urban contemporary"
Sleeping Beauty,0Cks68XMF8C89s1zTfFtR2,background music
Kiss Me On My Neck,4m0s3qbEpDu5OMGu0emD1O,"afrofuturism, alternative r&b, neo soul, r&b, soul"
Meaning of Life,2Tibxka4w154ISDA6Z4mnB,"alternative metal, nu metal, rap metal, rock"
Walking,5r5cp9IpziiIsR6b93vcnQ,"australian dance, australian electropop, dance rock, indietronica, neo-synthpop"
Outlaw Women,5kCsIDXG306DriJZ2gViLt,"country, country rock, outlaw country"
We're At The Top Of The World,4BejqreqjhlN3FcR2irbKg,emo
Just Got Wicked,20QoUUjUE4MW8eWCSeUGhX,"alternative metal, industrial metal, nu metal, post-grunge"
Crazy Eddie's Last Hurrah,1esj1LFgfyFRbU5brtALfE,classic texas country
With You,34SQ0QfLSR316d8KL2zkuZ,"classic texas country, contemporary country"
Pilgrim,1wVQzI9QHQHZ9hNXwpY5GZ,"celtic, middle earth, operatic pop"
Carlene,339hc1FygD8oJl4kg24IjG,"contemporary country, country, country road"
Arcarsenal,7pDbWHj7JkhCpJvk9bHy3M,"dance-punk, el paso indie, emo, garage rock, post-hardcore"
Say My Name,7H6ev70Weq6DdpZyyTmUXk,"dance pop, girl group, pop, r&b, urban contemporary"
Inner Smile,0yvDNlMoafoHNR9M5LIOGJ,"new romantic, new wave pop, scottish rock"
Ay Jalisco No Te Rajes,4euwnQbnoDNtXQ5LKNb07t,"bolero, mariachi, ranchera"
-1,09riz9pAPJyYYDVynE5xxY,"cloud rap, dark trap, new orleans rap, underground hip hop"
Played-A-Live (The Bongo Song) - Radio Edit,05Fd0bblXYHhnBsFhyYfHD,eurodance
Don't Call Me Baby,4fazGt0v2v2zkzddQOcDZD,"disco house, vocal house"
Silver Inches,5YNUF9XA2H4FyUUX391NDs,"celtic, middle earth, operatic pop"
What U See (Is What U Get),1gtcO05zF2TqQNx7jzm2Ur,"memphis hip hop, rap, southern hip hop, tennessee hip hop, trap"
Back in My Life,557q3cfw95ChPhoupTVUUZ,eurodance
Gone Guru,12aeWyYJIyUzysWpjAx7r4,
El Ayudante,4BAFNRzls9qwq9Zad15yKp,
Preciosa Sangre,0LXxKUA4sIwRDSPjyjtijp,"latin christian, latin worship, rock cristiano"
Love Song,6qL5UWxRSQYml9O99ozoLv,contemporary r&b
Knocking Pictures Off Da Wall (featuring Lil Flex) (feat. C-Nile & Solo-D),3cHxOOnaC6UjyMf8P4mpme,"dirty south rap, dirty texas rap, houston rap"
Violence Fetish,3jYNZPZA5qZHSdSAxBdn5q,"alternative metal, nu metal, rap metal, rock"
Life Of My Own,19v5b0qbqfqIDuRO8wxsIY,"alternative metal, nu metal, post-grunge, rock"
Opticon,0FXxj9RuhwtQbpUCoDgju7,"alternative metal, electronic rock, industrial metal, industrial rock, nu metal, post-grunge"
Day One,4vJKYtfJKym6Q1BoJ76z6R,"memphis hip hop, southern hip hop, tennessee hip hop, trap"
Watching You,5OusUgzHz6Ulb3GZT7WUo5,"contemporary country, country, country road"
El Sapo Y El Kora,4X0WfWExu6bcIgAiS06UPS,"banda, duranguense, grupera, musica nayarita, norteno, tecnobanda"
Como Me Duele Perderte,2NvsxLwEnF3FtJJsdhkdmq,new wave pop
Poison,5NijSs5dAwaIybq1GaRTIe,"r&b, rap"
Droppin' Plates,5io8MMxzdc8uq5VeIAO0Br,"alternative metal, nu metal, rap metal, rock"
Rose rouge,36apwMphkcaS63LY3JJMPh,"r&b, uk contemporary r&b"
You're Pretty Good Looking (For a Girl),5OjQHOLMSzm9gkcIhtsgMO,"alternative rock, blues rock, detroit rock, garage rock, modern blues rock, permanent wave, punk blues, rock"
September Grass,5oT7HmkPkGsi0SAB10D34x,"classic rock, folk, folk rock, heartland rock, mellow gold, singer-songwriter, soft rock"
I Belong To You,1nP6feYWJVpbO41aezFtm2,contemporary r&b
Strip For You,1AskFnURw6paF4HZNUOrfB,
Taking You Home,7AoJXxRBfLVF2Dpx75lcg9,"album rock, classic rock, heartland rock, mellow gold, singer-songwriter, soft rock, yacht rock"
Dios Manda Lluvia,1ZjfE0rjZ79eZb8scsRpYF,"latin christian, latin worship"
The Best Day,6ON9UuIq49xXY9GPmHIYRp,pop
Black Label,3tS1VMpxp9bLn46Cyh09el,"alternative metal, groove metal, hard rock, metal, nu metal"
Electricity,0NNSpmyyr0I4lrMaXS8Tba,"big room, dutch house, edm, electro house, pop dance, progressive electro house, progressive house"
Lo Doy Todo Por Ti,6MgyVKOthGKQLAXCcM6hEM,"bachata, bachata dominicana"
Te Perdi,1Q8NiatGDc6YgefNwT7Jgu,"latin pop, mexican pop"
Jump in the Line,1zW2csx1vVJrKfvDrFQNVt,calypso
Cyber Dance - Extended Mix,4Kw6JHqFZhgpCH9iLKgKeL,"eurobeat, super eurobeat"
Sólo Quería un Café,2kWYn9WboACIhmjQWRwMMX,"cantautor, latin arena pop, latin pop"
All I Really Want Is Love,4EtULbS8K8zZ3apaEX36oI,chanson
Death Letter,78ZPgT0agDUG95ByxpTNBP,"alternative rock, blues rock, detroit rock, garage rock, modern blues rock, permanent wave, punk blues, rock"
Lazy Days,59FHkvXahmMSZkMbC0vKRL,
勇氣,1SNF1IdMuKPDhw9HTrdcvM,"malaysian mandopop, mandopop"
She's Got It All,4l8u5h7OjkZo2UmyUoeKYJ,"contemporary country, country, country road, modern country rock"
Daddy's Home,2Vr3XMnJyu60xBUUchWUrI,
In Key,2ptNHiOb6DbdWytP2Nsslu,"deep smooth jazz, smooth jazz"
Junk Bond Trader,5I82Gy3FcoPGP4rzYbXADt,"alternative rock, indie rock, melancholia, singer-songwriter"
Represent,6DPrhGVJ1WTZvM9fKptnGe,"conscious hip hop, east coast hip hop, gangster rap, hardcore hip hop, hip hop, queens hip hop, rap"
The Way You Do The Things You Do,3496rr5XSGD6n1Z1OKXovb,"memphis soul, motown, soul"
"Nah, Nah... (feat. Nate Dogg)",0ytR1crCeDa016jH0xPa9o,"cali rap, hyphy, oakland hip hop, west coast rap"
The Real Slim Shady,3yfqSUWxFvZELEM4PmlwIR,"detroit hip hop, hip hop, rap"
Not Enough,55ZNNY6D8FkNFAlVceAwIZ,"chicago rap, melodic rap, rap"
100% (feat. Tony Sunshine) (feat. Tony Sunshine),6xeB09UZ7cnexyMkYdGlMS,"bronx hip hop, east coast hip hop, hardcore hip hop"
F*** You,4jVBIpuOiMj1crqd8LoCrJ,"hip hop, rap, slap house"
The Last Day of Summer,2psVFCWNGRqNY3Xs0y0ngI,
El Pianista,3SRD0rSAbzkaJf4PKlnrcX,"mexican rock, rock urbano mexicano"
Runaway,3DK6m7It6Pw857FcQftMds,"chicago rap, hip hop, rap"
Back Where I Come From - New Recording with Kenny's Band,2gdPoGz36VlwTB8SQCinWl,"contemporary country, country, country road, modern country rock"
Big Nel From Da Natti,1AHk54FiqDAikjiYqvwmAm,alternative hip hop
Title Track,4kDgnKgZTX6puRz9EoNjle,"ohio hip hop, pop rap"
Y Como Es El - Balada/ Mariachi,6AY9Mxk7ISICDAUwbztVmG,"grupera, gruperas inmortales"
Bodhran,6LVEYsHd4qJ1WtJZ9xhr2X,celtic rock
